"dc_title","dc_writer","writer_ip","dc_date"
"베토벤도 쇼팽 콩쿠르 우승 못 했지? 그러니까","음악의장남 ","211.36 ","05.29"
"클갤이 아무리 쓰레기판이 되어도","ㅇㅇ ","61.101 ","05.29"
"조성진 노벨상 하나 안주냐","ㅇㅇ ","223.39 ","05.29"
"클갤에서 난 ‘클래식 음악 호사가’라는 새로운 집단을 발견하게 됨","ㅇㅇ ","61.101 ","05.29"
"힐러리 시바협","클알 ","38.140 ","05.29"
"대법원장, 대법관 세 마리가 나란히 피고인석에.","쓱쓱쓱 ","211.36 ","05.29"
"전세계 클래식 시장은 조성진 원톱체제라구!!!!","ㅇㅇ ","175.223 ","05.29"
"제발 조줌아웃 좀 해라","ㅇㅇ ","125.184 ","05.29"
"대부분 좌빨새끼들이 정명훈 마에스트로님 싫어하더만","ㅇㅇ ","175.223 ","05.29"
"조성진이 미켈란젤리보다 훨씬 잘쳐!!","ㅇㅇ ","175.223 ","05.29"
"정명훈이 다른건 몰라도","ㅇㅇ ","39.7 ","05.29"
"아쉬케나지가 잘하냐 조성진이 잘하냐ㅋㅋㅋㅋㅋㅋㅋ","ㅇㅇ ","175.119 ","05.29"
"여기서 패악질 떨면 뭐 조성진이 감동이라도 먹을 줄 아냐?","ㅇㅇ ","49.174 ","05.29"
"루간스키는 황인종 찌끄래기 새끼들이 자기 폄하하는거 알까ㅋㅋㅋㅋ","ㅇㅇ ","175.223 ","05.29"
"조줌 vs 명반","ㅇㅇ ","125.184 ","05.29"
"루간스키 그 사람 라흐마니노프 프렐류드만 들어봣는데","ㅇㅇ ","210.206 ","05.29"
"여기에 아줌마들 많음??","ㅇㅇ ","223.33 ","05.29"
"아니 스케쥴이고 뭐고 ㅋㅋ","굴드 "," ","05.29"
"이 멜로디 어느 곡에서 나오는 지 아시는 분 있나요","ㅇㅇ ","175.208 ","05.29"
"줌마들은 개념글 무명인지 저게 실화라고 생각하는거야?","ㅇㅇ ","118.219 ","05.29"
"류쑤에찌엔판(열혈건반) 중국에 먹힌다","ㅇㅇ ","175.223 ","05.29"
"조선김 vs 열혈건반","ㅇㅇ ","175.223 ","05.29"
"나도 2020 쇼콩 나간다 기대해라","조상진 ","223.39 ","05.29"
"루간스키의 라이벌","ㅇㅇ ","175.223 ","05.29"
"루간스키한테 비빌거면 드릴로 느그들 귀 뚫어버려","ㅇㅇ ","175.223 ","05.29"
"박종화가 러시아 국적이면 루간스키보다 잘 나갔을 듯","ㅇㅇ ","175.223 ","05.29"
"루간스키한테 조성진 비비는건 생각이 있는거냐?","ㅇㅇ ","175.223 ","05.29"
"그래도 오늘 전주시향 공연 대체적으로 만족함","ㅇㅇ ","223.33 ","05.29"
"아니.. 커리어가 어쩌고 그런걸 왜 따져ㅋㅋㅋ","ㅇㅇ ","61.101 ","05.29"
"올해 말러 부활 언제 하나","돼지돼지 ","125.133 ","05.29"
"전주시향,,,,, 하","최희준 ","112.146 ","05.29"
"대체 엘가는 뭔재미로 듣는거냐","황당한나라 "," ","05.29"
"연주자들은 도데체 페이 얼마나 받는거냐? 세금은 잘 내고있을까?","ㅇㅇ ","218.38 ","05.29"
"골수 문재인빠였던 내가 돌아선 이유.","ㅇㅇ ","221.150 ","05.29"
"베피소 피아니스트 추천좀 해줘","ㅇㅇ ","223.38 ","05.29"
"피아니스트중의 피아니스트","탐험용배 ","222.233 ","05.29"
"살려내라","디시콘전용닉 "," ","05.29"
"인기 별로 없는데 좋아하는 음악가 있어?","ㅇㅇ ","175.223 ","05.29"
"서울대현악합주 보러왔는데","ㅇㅇ ","147.47 ","05.29"
"이마트 가면 할아버지 소리 듣는 명반이다.","쓱 ","211.36 ","05.29"
"오늘 강심가서 드보르작 피협 예습하는데 무지좋네..?","ㅇㅇ ","223.62 ","05.29"
"클린한 클갤을 즐기는 법","ㅇㅇ ","121.154 ","05.29"
"지휘자중에 간결하고 정석적으로 지휘하는 지휘자 누구 있어?","ㅇㅇ "," ","05.29"
"웅장하고 꽝꽝거리는곡 갑","ㅇㅇ ","223.39 ","05.29"
"현악 곡이나 바이올린협주곡 위주로 듣는데 음향설정 질문좀","ㅇㅇ ","121.150 ","05.29"
"웅장하고 꽝꽝거리는 곡 추천 좀","ㅇㅇ ","39.7 ","05.29"
"무명 피아니스트들이 자주 하는 말","ㅇㅇ ","175.223 ","05.29"
"피아니스트들의 피아니스트는 누구에여? ","ㅇㅇ ","59.11 ","05.29"
"임주희 라흐 3번 치네","ㅇㅇ ","175.223 ","05.29"
"바렌보임옹","ㅇㅇ ","125.184 ","05.29"
"클린이들 보세요. -2","ㅇㅇ ","125.184 ","05.29"
"카톡 프로필 음악 클래식 올려놓는 멋쟁이들 있냐","ㅇㅇ ","223.33 ","05.29"
"조팬들이 조성진 생일 인스타 안올려줘서 서운하대","ㅇㅇ ","223.39 ","05.29"
"전주시향 상임지휘자 바뀌고 처음인데","ㅇㅇ ","223.33 ","05.29"
"근데 강남심포니 전설의 볼레로 어디가면 들을 수 있음?","Kapustin "," ","05.29"
"강남 심포니 잘 하나요?","Marx "," ","05.29"
"클갤은 유구한 개한민국 역사같네","ㅇㅇ ","183.96 ","05.29"
"스폰이 없으면 안되는 건가?","ㅇㅇ ","210.206 ","05.29"
"여러분 조줌들이 좌표를 찍었습니다","ㅇㅇ ","175.223 ","05.29"
"ㅇㅇ줌들의 무적의 키워드","ㅇㅇ ","175.223 ","05.29"
"군악대로 군대빠지는거 힘드냐?","ㅇㅇ ","58.120 ","05.29"
"조성진을 망치는 건 조줌. 나는 조성진이 잘되기만을 바란다.","ㅇㅇ ","175.223 ","05.29"
"조성진 지난 4년간 뭐 하나 성과 낸 것이 없다.","부족 ","211.36 ","05.29"
"물빨할거면 마갤파서 즈그끼리 물빨하면 끝날 일을","ㅇㅇ ","175.211 ","05.29"
"조줌새끼들은 조성진 조금만 비판해도 글 신고하네?","ㅇㅇ ","175.223 ","05.29"
"~~줌 하는 새끼들 자체가 정신병 걸렸다고 보면 됨","ㅇㅇ ","175.223 ","05.29"
"한국 문화예술 발전은 진짜 군대가 한다","ㅇㅇ ","175.223 ","05.29"
"정명훈 진지빨고 신뢰가 안 감","ㅇㅇ ","223.62 ","05.29"
"어제 대구 클라라","ㅇㅇ ","27.166 ","05.29"
"슈피협 추천해줘","ㅇㅇ ","110.70 ","05.29"
"여윽시 클갤주는 정명훈이다","ㅇㅇ ","223.62 ","05.29"
"개줌들은 느그갤가서 싸우세요 제발","굴드 "," ","05.29"
"게시판이 왜케 시끄럽냐 오늘 강심가는가람 잇음?","ㅇㅇ ","223.62 ","05.29"
"클린이인데요 호로비츠꺼 들으면","ㅎㅎ ","39.7 ","05.29"
"알파고 교수님한테 레슨받으니 너무 좋네","ㅇㅇ ","125.134 ","05.29"
"요즘 공연장 반팔입으면 추울라나","ㅇㅇ ","223.33 ","05.29"
"클갤에서 까이는 연주자 = 잘나간다는 보증수표","ㅇㅇ ","175.223 ","05.29"
"선우예권빠들 보면 그냥 애잔하고 웃긴게 ㅋ","ㅇㅇ ","223.38 ","05.29"
"선우예권 인스타 보면 자기 팬들 좋아하는 거 같은데 왜 니들이 난리","ㅇㅇ ","175.223 ","05.29"
"선우줌냐들 없는줄알았는데 많네","ㅇㅇ ","223.39 ","05.29"
"6월 볼만한 공연 추천좀","ㅇㅇ ","223.62 ","05.29"
"설마 선우예권이 조성진만큼 뜨길 바란거임?","ㅇㅇ ","223.39 ","05.29"
"ㅅㅇㅇㄱ이 사생 박제한거 같기도 하고","ㅇㅇ ","112.148 ","05.29"
"정명훈은 선우예권이랑 슈만피협 하려고 했어","ㅇㅇ ","110.70 ","05.29"
"선우 팬아 현실을 봐라","ㅇㅇ ","175.223 ","05.29"
"ㅅㅇㅇㄱ 이 자기 팬들 싫다잖아","ㅇㅇ ","112.148 ","05.29"
"차이콥스키 교향곡 4/5/6중에 뭐가 젤 마니 연주됨?","ㅇㅇ ","223.62 ","05.29"
"끌올 미안ㅠ 차이콥스키 능력자들 좀 도와죠ㅠㅠ","ㅇㅇ ","116.127 ","05.29"
"선우예권 팬들은 피해의식 있을수밖에 없음","ㅇㅇ ","175.223 ","05.29"
"추천 클래식 유튜버","ㅇㅇ ","175.223 ","05.29"
"클갤 한정 짐머만급의 손민수의 슈피협","ㅇㅇ ","175.223 ","05.29"
"브람스 피아노 협주곡은 문지영","ㅇㅇ ","175.223 ","05.29"
"클래식 주로 듣는데 이어폰 추천좀","ㅇㅇ ","124.61 ","05.29"
"선우줌들 신났네","ㅇㅇ ","223.62 ","05.29"
"공연 뭐하러 다니냐?","모모카 ","115.138 ","05.29"
"근데 여기 관크애들 눈팅하고 글 엄청 쓰네 ㅋㅋ","ㅇㅇ ","112.148 ","05.29"
"클래식 기획사, 연주자들은 사생에 극 주위할 것","ㅇㅇ ","112.148 ","05.29"
"헨델의 건반을 위한 파사칼리아... 영화장면, 스칼라티와 즉흥대결","ㅇㅇㅈ ","99.240 ","05.29"
"퀸콩 우승 연주 영상.. 정말 실망...","클알 ","38.140 ","05.29"
"루간스키는 조성진 넘기 전에 이분부터","ㅇㅇ ","175.223 ","05.29"
"ㅅㅇㅇㄱ 강릉에서도 똑같은 관크;","ㅇㅇ ","39.118 ","05.29"
"쇼스타코비치 교향곡 7번","하고방스 ","114.200 ","05.29"
"한국인 조성진은 한국클래식음악협회에 상금전액을 기부하라 ","ㅇㅇ ","125.134 ","05.29"
"헨델 건반 음악 좀 추천 해주세요","wlltmprdclvr7 "," ","05.29"
"현재 전공생들이 좀 지켜줬으면 하는 것.","ㅇㅇ ","125.184 ","05.29"
"선우 해외 에이전트 없어?","ㅇㅇ ","175.223 ","05.29"
"조만간 조성진을 리히터 호로비츠 길렐스에도 비비겠네","ㅇㅇ ","175.223 ","05.29"
"조성진을 루간스키한테 비빈다고?ㅋㅋㅋㅋ","ㅇㅇ ","175.223 ","05.29"
