"dc_title","dc_writer","writer_ip","dc_date"
"근데 요즘 골드는 저렴하게사고 비싸게파는게 대세임?","ㅇㅇ ","223.33 ","05.28"
"형들 뉴비아닌 뉴비 바로 점핑으로 시작해도되??","ㅁㅁ ","14.52 ","05.28"
"슬픈소식)월말엔 원래 점검길게했었음","dd ","223.38 ","05.28"
"핵슬 타이틀은 언제때냐?","ㅇㅇ ","121.170 ","05.28"
"뉴비 요호 첨잡앗다","ㅇㅇ ","59.31 ","05.28"
"내일 없데이트로다가","ㅇㅇ ","175.121 ","05.28"
"골드시세 1:1까지가냐?","ㅇㅇ ","121.170 ","05.28"
"근대 너희도 알고 있잔아","321 ","211.36 ","05.28"
"에스토크 수탐 1티어 선원조합 뭐임?","ㅇㅇ ","14.44 ","05.28"
"이러다 ㄹㅇ 4니츠+1바드 주캐유저만 남을듯","ㅇㅇ ","1.211 ","05.28"
"우끼끼","티디엔 "," ","05.28"
"로헨델 몇렙에 들갈수있어?","ㅇㄷ ","211.109 ","05.28"
"내일 없뎃이면 진짜 싼다","ㅁㄴㅇ ","124.58 ","05.28"
"기공사 에네르기파도 너프가 맞지","ㅇㅇ ","1.211 ","05.28"
"고고학 찬란한4랭 수급방법아는사람;;","ㅇㅇ ","58.231 ","05.28"
"이런식이면 나 곤란한데","ㅇㅇ ","211.33 ","05.28"
"스마게 오늘 회사에 불 났으면 좋겠음","ㅇㅇ ","14.45 ","05.28"
"아바타가 문제가 아니라 밸패가 먼저인듯","ㅇㅇ ","211.116 ","05.28"
"씨발 타이탈 매칭 지랄났네 ㅋㅋㅋㅋㅋㅋㅋㅋ 개새끼들아","클라나 "," ","05.28"
"경쟁전 인파새기 자꾸 피아구분 못하네","ㅇㅇ ","223.38 ","05.28"
"로아가 아무리 밸런스 좆망겜이지만 파판은 많이 아니지....","ㅇㅇ ","211.116 ","05.28"
"로아 업뎃순서 알려준다","ㅇㅇ ","222.114 ","05.28"
"팩트는 MVP 시스템이 내일 나온다는 것도 행복회로임","ㅇㅇ ","121.172 ","05.28"
"시리우스 갤길 하와와군필여고생쟝이에요 선착순 모집한다","ㅇㅇ ","39.7 ","05.28"
"로아에 정들어서 못접겠음..","ㅇㅇ ","112.158 ","05.28"
"좆레기 계승한 타나토스 개오지네","ㅇㅇ ","182.226 ","05.28"
"다들 내일 mvp는 나온다고 생각하는거임?","ㅇㅇ ","210.57 ","05.28"
"인벤 레벨20이상 아이디 삽니다.","인벤삼 "," ","05.28"
"꼬우면 접어 좀 병신들아 ㅋㅋㅋ","ㅇㅇ ","223.38 ","05.28"
"내일 패치내역 알려줌 ㅇㅇ;;","ㅇㅇ ","118.37 ","05.28"
"당신의 MVP에 투표하세요!","ㅇㅇ ","61.99 ","05.28"
"매칭에서 보드라 그러니가 화내네","ㅇㅇ ","223.38 ","05.28"
"얘들아 파판14 하자~~!!!!","ㅇㅇ ","115.161 ","05.28"
"뉴비질문))초단에서 경쟁전 한판하면 실버임?","ㅇㅇ ","14.5 ","05.28"
"딜러 해보니간 공팟 보드새끼들 수준 처참하네","ㅇㅇ ","182.212 ","05.28"
"점핑권 바드 기공사 둘중 고민했는데","ㅇㅇ ","124.54 ","05.28"
"타탈 가려는데 어떻게 해야될까요","ㅇㅇ ","14.44 ","05.28"
"경쟁전 같은팀 못한다고 욕하는것도 지얼굴에 침뱉기지 ㅋㅋㅋ","ㅇㅇ ","210.107 ","05.28"
"지갑전사 버서커 디트 서머너 유저가 결제금액 높음 ","ㅎㅎㅎ ","1.211 ","05.28"
"에스토크 업글재료 다 어디서 파는거야?","160 "," ","05.28"
"일단 밸패 좀 하고서 이야기 하면 안되냐","ㅇㅇ ","118.37 ","05.28"
"카드베틀 4단계만있는줄알았음 ","형이닼ㅋㅋ ","110.70 ","05.28"
"MVP 시스템 그냥 별거 아닐 확률 농후 100%","ㅇㅇ ","121.172 ","05.28"
"경쟁전 1~13등까지 바드 1명 뺴고 다 애니츠 ㅋㅋㅋㅋ","ㅇㅇ ","119.196 ","05.28"
"다필요없고 밸패만해도 만족함","ㅇㅇ ","1.240 ","05.28"
"경쟁전 존나 희한한게 씨발 ㅋㅋ","ㅇㅇ ","175.223 ","05.28"
"항해 쓸만하게 하려면 무슨배 선원 쓰냐","160 "," ","05.28"
"맨날 내일없뎃이면 로아망함 이글 매주화요일마다보는듯","ㅇㅇ ","124.80 ","05.28"
"팩트 : 로아는 한섭에 별미련없음ㅋㅋ 테섭","ㅇㅇ ","121.142 ","05.28"
"좆 마 게","ㅇㅇ ","221.141 ","05.28"
"길바갤에서 조문왓읍니다","ㅇㅇ ","125.132 ","05.28"
"내일mvp 패치되면 배마 창술 데헌은 mvp못먹으면 손이병신인거맞지?","ㅇㅇ ","124.80 ","05.28"
"벌목 정수 찬란한 지도 잘나옴?","ㅇㅇ ","58.231 ","05.28"
"내일 없뎃이면 진짜 로아생명 끝이긴하네 ㅇㅇ","노루상향해 "," ","05.28"
"루페온 늒네 길갑좀 ","ㅇㅇ ","223.62 ","05.28"
"7시간 뭔데 ㅋㅋㅋㅋㅋㅋ 욘각 떳냐? ㅋㅋㅋㅋ","ㅇㅇ ","223.39 ","05.28"
"로아특 : 오랜만에 연어해도 숙제하나하고 바로끔","ㅇㅇ ","121.142 ","05.28"
"내일 주레즉완권 나온다 두고봐라","ㅇㅇ ","121.144 ","05.28"
"이 좆망겜은 무슨 자신감으로 항상 이벤트를 창렬하게함","ㅇㅇ ","121.172 ","05.28"
"내일 없데이트면 0%대갈듯","ㅇㅇ ","220.121 ","05.28"
"ㄹㅇ 게임 컨텐츠보다 재밌네","ㅇㅇ ","59.19 ","05.28"
"Pvp예상등급6단으로떨어졌네","ㅇㅇ ","125.178 ","05.28"
"배마하다가 창술하니까 존나힘드러","ㅇㅇ ","121.129 ","05.28"
"유령선 4캐릭 완료 ㅋㅋㅋㅋㅋㅋㅋㅋ","ㅇㅇ ","210.107 ","05.28"
"ㅋㅋㅋ 사실 낼 똥줄타는건 스마게지 그담날 poe오픈함","ㅇㅇ ","121.142 ","05.28"
"갤 글리젠 개씹창났네;","ㅇㅇ ","180.67 ","05.28"
"우끼우끼 유령선 탔다 우끼끽","ㅇㅇ ","118.217 ","05.28"
"즉완권 네이버 뉴스보고 간만에 이갤 왔는 데 에픽레이드 뜸?","ㅇㅇ ","110.47 ","05.28"
"내일 갓패치 or 혜자 이벤트 둘 중 하나는 무조건 함","ㅇㅇ ","119.196 ","05.28"
"우끼끼 이번주 본부캐 둘다 유령선 완료^^","ㅇㅇ ","58.231 ","05.28"
"ㅋㅋ 내일","ㅇㅇ ","1.214 ","05.28"
"보급품 줍는거 동해 서해 차이 잇음? 한파에서 할거","티디엔 "," ","05.28"
"스마게가 병신이아닌이상 내일패치 갓패치뜬다","ㅇㅇ ","211.36 ","05.28"
"스마게 = 문재인","ㅇㅇ ","116.37 ","05.28"
"승부사 하려면 투지증표 36000개면 되지?","ㅇㅇ ","222.114 ","05.28"
"들은 소문에 불가한데","ㅇㅇ ","112.133 ","05.28"
"연습) 시발 패치한게 많으니 버그도 좆나 많네 ㅋㅋㅋㅋㅋ","티디엔 "," ","05.28"
"게임이 컨텐츠는 많은데 정작 할만한건 없는거같음","잉 ","125.128 ","05.28"
"스마게 정신차리려면 크파, 에픽세븐이 망해야함","ㅇㅇ ","116.37 ","05.28"
"매냐골드개떡락 패치유출이라도 했냐??","ㅇㅇ ","115.126 ","05.28"
"병신들아 지금이라도 다시이거나해","ㅇㅇ ","211.109 ","05.28"
"검사는 쌀먹이 안되는게 장점이자 단점임","123123 ","39.120 ","05.28"
"루페온 팟창도 다 죽어가는데 딴섭들은 거의 없을듯","ㅇㅇ ","110.70 ","05.28"
"지령서 아까워서 3장 꼬박꼬박 챙겼는데 드디어 귀찮아서 포기","ㅇㅇ ","121.132 ","05.28"
"내생각에 로아 개발 늦어진 원인 중 하나는 최적화였던 것 같음","ㅇㅇ ","116.37 ","05.28"
"골드리버 금강선이 쓰는 닉네임임","ㅇㅇ ","117.111 ","05.28"
"내일 없뎃이면 갤 터지나욤?","ㅇㅇ ","221.141 ","05.28"
"???: 내가 왜 딜금이냐","ㅇㅇ ","143.248 ","05.28"
"낼 이것좀 추가했으면 좋겠다","ㅇㅇ ","223.33 ","05.28"
"우끼끼 끼끼끼","ㅇㅇ ","121.142 ","05.28"
"겜을 살리는 유일한 시스템 '임신'","ㅇㅇ ","110.70 ","05.28"
"홍요호 버스 얼마정도 하냥...","ㅇㅇ ","222.100 ","05.28"
"Poe가 하루종일 미궁 돌아 다니는 개념임?","ㅇㅇ ","117.111 ","05.28"
"루페온 1위 길드 기력이다한겜창 길드원 모집","ㅇㅇ ","221.154 ","05.28"
"퐁퐁이 검스 지리네","ㅇㅇ "," ","05.28"
"던파하는게 남 로아하는게 남 ?","ㅇㅇ ","112.161 ","05.28"
"루페온 기력이다한겜창 길드에서 바드 유저 구함","ㅇㅇ ","221.154 ","05.28"
"내일 못 접는 애들은 평생 간다 봐야지 ㅇㅇ","ㅇㅇ ","117.111 ","05.28"
"로아 제일 큰 문제는 개발 역량이 없다는거임","ㅇㅇ ","116.37 ","05.28"
"아재들은 즉완권 더 좋아함","ㅇㅇ ","223.62 ","05.28"
"진짜 요즘 로아 안하게되더라","ㅇㅇ ","175.113 ","05.28"
"이미 대거 꼬접 시기는 지낫어","ㅇㅇ ","223.38 ","05.28"
"(구)파판이 지금 로아보단 심각했음 걱정 ㄴㄴ","ㅇㅇ "," ","05.28"
"내일 기공 하향안하면 접는다","ㅇㅇ ","1.226 ","05.28"
"웃긴 것이 금강선공 하나만이 안잖앜ㅋㅋㅋ","ㅇㅇ ","106.102 ","05.28"
"낼 없뎃이면 0.퍼대 가는거냐?","prison "," ","05.28"
"본캐 보드인데 부캐 머하는게조음","ㅇㅇ ","223.38 ","05.28"
"내일 아무것도 안나와 븅신들아ㅋㅋ","ㅇㅇ ","223.38 ","05.28"
"스마게 운영이 씹망인건 외국도 잘 앎 ㅋㅋ","ㅇㅇ ","116.37 ","05.28"
"내일 패치보고 여전히 병신같으면 모레 poe 하러가면됨 ㅋㅋ","ㅇㅇ ","210.107 ","05.28"
"근데 시기상 레이드나오고 mvp나올것같은데 씨발","ㅇㅇ ","175.223 ","05.28"
"마지노선이아니라 매주노선인듯","zzz ","58.122 ","05.28"
"욘 나올 때쯤엔 던전 즉시완료도 나와ㅋㅋㅋㅋ","ㅇㅇ ","106.102 ","05.28"
"겜에 돈마니 쓰는 아재들은 즉완권보다 밸런스에 분노하던데","ㅇㅇ ","218.155 ","05.28"
"기공 사기라는 애들 특징.txt","ㅇㅇ ","61.253 ","05.28"
"칼엘리고스 배기기기 바드없어도 존나쉬움","기공만세 ","223.38 ","05.28"
"키워보면 생각보다 재밌는 직업","ㅇㅇ ","182.219 ","05.28"
"점핑 해도 결국 메인스토리 깨야함?","ㅇㅇ ","180.150 ","05.28"
"모든서버 통합하면 초창기 로아느낌 날수있음?","123123 ","39.120 ","05.28"
"그래서 메갈14 처럼","흑우파티 "," ","05.28"
"사실 제작자 이름을 게임 내부에 넣는건 흔하지","ㅇㅇ ","211.33 ","05.28"
"특정 직업에 디렉터 이름 박아 쳐넣는 짓이 정상은 아님","ㅇㅇ ","116.37 ","05.28"
"걍 밸런스보다 게임이 좃노잼인게 문제지","ㅇㅁㅇ ","223.38 ","05.28"
"솔직히 그 디렉터 이름박힌 그 직업 의심되긴 해","ㅇㅇ ","218.155 ","05.28"
"연습) 주간레 즉완권 미쳤네 시발 ㅋㅋㅋ","ㅇㅇ ","110.70 ","05.28"
"창술사 좆노잼인데 정상이냐?","ㅇㅇ ","121.137 ","05.28"
"애니츠는 원탑인데","ㅇㅁㅇ ","223.38 ","05.28"
"기공사 자캐딸 치는 병신 금강선놈아 ","ㅇㅇ ","223.62 ","05.28"
"제시충 = 용팔이","ㅇㅇ ","222.111 ","05.28"
"내일패치가 진짜 마지막 마지노선임","123123 ","39.120 ","05.28"
"팩트 ) 겜이 진짜 재밌으면 밸런스도 컨텐츠화됨","ㅇㅇ ","121.142 ","05.28"
"연습) ㅋㅋ 벌써 미워도 다시한번하넼ㅋㅋㅋ","ㅇㅇ ","121.170 ","05.28"
"아니 씨발 도대체 돌대1은 왜 끼는거야 ㅋㅋ","ㅇㅇ ","61.79 ","05.28"
"템렙시스템 이렇게 바뀌면 갓겜아니냐 ?? 한번바바","ㅇㅇ ","121.142 ","05.28"
"이그하람 기습 4.5~5천 골에 산다고 올라오네 ","ㅇㅇ ","223.62 ","05.28"
"워로드는 pvp딜 너프 해야지","ㅇㅇ ","121.170 ","05.28"
"연습)아크3 ㅋㅋㅋㅋㅋㅋㅋ","융털 "," ","05.28"
"지금 기습 사는건 장사꾼들이지","ㅇㅇ ","61.99 ","05.28"
"창녀 출시가 밸붕 오져서 오히려 반감효과 생겨 꼬접 더 생겼을거임","ㅇㅇ ","183.106 ","05.28"
"흑요 얼마나 잡아야될까.....","11 ","175.208 ","05.28"
"이게임 디렉터가 문준용임?","ㅇㅇ ","222.112 ","05.28"
"한주만 더 한주만 더 하다가 90퍼 유저가 빠졋는데","ㅇㅇ ","118.39 ","05.28"
"요새 인파런칭 얼마함?","ㅇㅇ ","210.178 ","05.28"
"아무리 접어도 검사,메이플,던파보단 훨 낳다고 생각함","ㅇㅇ ","222.106 ","05.28"
"형들 점핑기간이 언제까지 가능했지?","ㅇㅇ ","211.200 ","05.28"
"지금 기습 3700씩 주고 사는 사람들 개호구 ㅋㅋ","ㅇㅇ ","222.103 ","05.28"
"낼 바쁘게 후다닥 욘 패치할듯ㅋㅋㅋㅋㅋ","ㅇㅇ ","121.169 ","05.28"
"아직 점핑안썼는데","ㅇㅇ ","121.144 ","05.28"
"던공 vs 유인원","ㅇㅇ ","121.142 ","05.28"
"이 게임에 보상 좋은 컨텐츠가 있긴하노? ㅋㅋㅋㅋㅋㅋㅋㅋㅋㅋㅋ","ㅇㅇ ","121.169 ","05.28"
"연습) 베른에서 욘 정기선 몇실링임??","ㅇㅇ ","110.70 ","05.28"
"누가 초인종을 3번이나 눌렀다","ㅇㅇ ","223.33 ","05.28"
"스마게 이 병신들","형이닼ㅋㅋ ","110.70 ","05.28"
"솔직히 템렙시스템 버리면 존나 재밋어질걸 ?","ㅇㅇ ","121.142 ","05.28"
"시너지 시스템 하나 해결 못허는데 갓겜?","ㅇㅇ ","118.39 ","05.28"
"천둥날개 보상 개창렬이네","ㅇㅇ ","118.218 ","05.28"
"던파 너무재밌다 하하 로아보다 훨잼네","ㅇㅇ ","218.155 ","05.28"
"욘이 나온다고 이 볼륨이 갑자기 전부다 갓겜으로 변하냐","puzzlewell "," ","05.28"
"갓디텍터가 있긴했지","ㅇㅇ "," ","05.28"
"걍 한달만 우레가 운영만 해도 겜 달라짐","ㅇㅇ ","121.169 ","05.28"
"검은사막 기대하지마라 ㅇㅇ","puzzlewell "," ","05.28"
"로아를 반면교사로 다음게임은 성공하시길 기원합니다 ^^","ㅇㅇ "," ","05.28"
"진짜 이겜 갓디렉터가 3개월만 손보면 갓겜될거같은데","ㅇㅇ ","121.142 ","05.28"
"아니 근데 검은사막 광고 왤케 로아 저격하는거같냐 ㅋㅋㅋㅋㅋㅋㅋㅋㅋㅋㅋㅋ","ㅇㅇ ","121.169 ","05.28"
"템렙시스템 버려야 로아가 산다","ㅇㅇ ","223.62 ","05.28"
"ㄹㅇ섭통더해야됨 에버때랑 아슈때랑 별 차이가 없어 ㅋㅋ","선생님제발망겜좀하지마세요 "," ","05.28"
"근데 아크3 안내면 영원히 만렙 556 아님? ㅋㅋ","ㅇㅇ ","116.37 ","05.28"
"워로드 살리는 방법 ㄹㅇ","ㅇㅇ ","14.32 ","05.28"
"원한 회랑이나 필드몹 적용되냐?","ㅇㅇ ","175.223 ","05.28"
"좆망겜 답게 인정하고 제 2차 서버 통합이 절실함","ㅇㅇ ","121.172 ","05.28"
"히오스랑 로아랑 ㄹㅇ 판박이같음","ㅇㅇ ","175.223 ","05.28"
"낼 전서버 통합임","ㅇㅇ ","121.175 ","05.28"
"낼은 레알 통합 마무리 업뎃이잖냐","형이닼ㅋㅋ ","110.70 ","05.28"
"로아가 흥하려면 좆같은 템렙버리고 에픽레이드나와야함","ㅇㅇ ","121.142 ","05.28"
"내일패치만되면그냥","ㅇㅇ "," ","05.28"
"에이번 파는색기가 없자나 시발 에이번 산다고","ㅇㅇ ","210.107 ","05.28"
"진짜 좆망겜인게 죽협 + 이벤트 섬해도 해양 채널 4개가 한계임","ㅇㅇ ","121.172 ","05.28"
"로아 패치 1일전, poe 오픈 2일전","ㅇㅇ ","121.142 ","05.28"
"ㅋㅋ 내일 패치에따라 poe에 완전 흡수되겠누","ㅇㅇ ","121.142 ","05.28"
"아크3나오면 점유율10%회복할텐데","ㅇㅇ ","222.106 ","05.28"
"내일 업데이트 : MVP 시스템, 섬 4종 업데이트다","ㅇㅇ ","121.172 ","05.28"
"내일 패치에 섬마 가챠나오면 갓겜 ㅇㅈ?","ㅇㅇ ","121.142 ","05.28"
"간만에 들어가서 숙제했는데","RemFelt "," ","05.28"
"아카테스는 아마 다음주나 다다음주에 나올 것으로 예상되는 듯","ㅇㅇ ","121.172 ","05.28"
"이번주 유령선 했는지 안했는지 체크하는 방법있냐?","ㅇㅇ ","121.139 ","05.28"
"이런거보면 롤이 존나 대단한것같음","네온테트라 ","221.139 ","05.28"
"7시간 점검은 좀 기대되는데?","ㅇㅇ ","112.158 ","05.28"
"욘은 빨라야 6월말 = 신규 장비 6월 말","ㅇㅇ ","121.172 ","05.28"
"아니 씨발 주간퀘 새벽에 할려고 미뤄놨는데 3시~10시 점검 좆같노","ㅇㅇ ","49.142 ","05.28"
"에포나 이카던 비던 카게 매일 하는중","ㅇㅇ ","211.179 ","05.28"
"접어도 아크 7개는 모으고 접을거다","ㅇㅇ ","49.142 ","05.28"
"하 ㅅㅂ.... 런칭압사고 존버했는데 휴지됐누 ㅋㅋㅋ","ㅇㅇ ","121.142 ","05.28"
"사람들 반응 이해가 안되네 ","ㅇㅇ "," ","05.28"
"창술이 무력말야","형이닼ㅋㅋ ","110.70 ","05.28"
"회랑상자 47개까서 입장권1장나오네","ㅇㅇ ","1.231 ","05.28"
"단계별 망하는법","ㅇㅇ "," ","05.28"
"좆망겜 결국 욘으로 가는 배는 못보고 간다","ㅇㅇ ","122.47 ","05.28"
"단계별 접는증상","ㅇㅇ ","39.116 ","05.28"
"로아특)","ㅇㅇ "," ","05.28"
"아직도 탈출못한놈들 ㅋㅋㅋㅋ","ㅇㅇ ","49.170 ","05.28"
"16~17년에 rpg 대작이 안나왔었나?","ㅇㅇ ","117.123 ","05.28"
"스까충들  모러그랫냐","형이닼ㅋㅋ ","110.70 ","05.28"
"야 겜창새끼들 원래 이러냐??한 4일 미접하니 찾네","ㅇㅇ ","119.207 ","05.28"
"내일 업데이트 목록","ㅇㅇ ","203.226 ","05.28"
"내일 욘 나오면 미친듯이 달려야겄노 ㅋㅋ","ㅇㅇ ","211.179 ","05.28"
"씨발ㅋㅋ저티어매칭종자 병신새끼존나많네","ㅇㅇ ","121.129 ","05.28"
"내일 욘이 왜나오노 ㅋㅋㅋ","ㅇㅇ ","223.62 ","05.28"
"솔직히 욘나오면 바짝은 흥한다","ㅇㅇ "," ","05.28"
"현생을 살자 얘들아","ㅇㅇ ","39.116 ","05.28"
"연습)ㅈㅅ 기공사는 쫌...","ㅇㅇ "," ","05.28"
"워로드를 무력화 시너지 주고 무력화 특화로 가고","ㅇㅇ ","118.39 ","05.28"
"씨발 저번주 화요일도 이랫던거같은대 ㄹㅇ ㅋㅋㅋㅋㅋ","선생님제발망겜좀하지마세요 "," ","05.28"
"내일갓패치하면","ㅇㅇ "," ","05.28"
"칼엘 배마필요없지 않음?","ㅇㅇ ","117.111 ","05.28"
"던파 지금해도 할 만하냐","ㅇㅇ ","58.237 ","05.28"
"내일 욘이랑 막 아카테스랑 섬마음통합에 와","ㅇㅇ "," ","05.28"
"이겜은 성인겜이라면서 성인겜.특성이 하나도 없음","ㅇㅇ ","211.36 ","05.28"
"그릇된 조각 원래 3개밖에 안 주냐?","ㅁㅈ ","59.7 ","05.28"
"쩜핑이 빚조은개살구인게","형이닼ㅋㅋ ","110.70 ","05.28"
"로아 1달해본 검사 유저로써 평가함","ㅇㅇ ","223.38 ","05.28"
"형 혹헬졸업하구 타이탈감","형이닼ㅋㅋ ","110.70 ","05.28"
"토탈워는 하고 싶어도 존나 하기 싫은게","ㅇㅇ ","116.37 ","05.28"
"에르제베트냐 크리스틴이냐","ㅇㅇ ","175.121 ","05.28"
"로아 1월인가 2월에 접었는데 지금디트 어떻냐?","ㅇㅇ ","121.162 ","05.28"
"업뎃 하나 안하나 망한건 매한가진데","ㅇㅇ ","121.130 ","05.28"
"토탈워 삼국 시작하고나서 로아 진짜 호감도 에포나만 하고 끔","ㅇㅇ ","183.97 ","05.28"
"매주 분기점이긴 했지 ㅇㅇ","puzzlewell "," ","05.28"
"로스트아크 직업 1티어 추천좀","ㅇㅇ ","58.237 ","05.28"
"망해도 솔직히 메던이나 검사보단 나음","ㅇㅇ "," ","05.28"
"로아 정공세끼들 검은사막 넘어올 생각 ㄴ","ㅇㅇ ","223.38 ","05.28"
"매주 분기점이라했는데 이번에는 진짜임 정말로","ㅇㅇ ","112.158 ","05.28"
"핵슬로 광고한 이유","puzzlewell "," ","05.28"
"근데 로아 첨에 핵앤슬래시라는 애들 머임?","ㅇㅇ ","223.38 ","05.28"
"좋든 나쁘든 내일 패치가 기대되는건 사실이지 ㅇㅇ","puzzlewell "," ","05.28"
"로아 망해서 검은사막 할려고 잠깐 봤는데","puzzlewell "," ","05.28"
"검은사막 그래픽에 로아면 어떨것같노","ㅇㅇ ","112.158 ","05.28"
"배마 스킬 조금만 찍어도 쓸만한거 뭐있냐","잉 ","125.128 ","05.28"
"얘들아 로아 접지마","ㅇㅇ ","116.37 ","05.28"
"섬마즉시완료권 팔아라","ㅇㅇ ","223.62 ","05.28"
"ㄹㅇ 아직도 이 좆망겜하는새끼가있음 ?","ㅇㅇ ","183.109 ","05.28"
"리사의 편지는 왜 안나오냐?","ㅇㅇ ","211.207 ","05.28"
"야 견습 레이드 1인 클리어 가능함?","ㅇㅇ ","121.137 ","05.28"
"내일 업데이트 미리보여줌","ㅇㅇ ","223.38 ","05.28"
"진짜 어마어마한 놈 봤다","ㅇㅇ ","14.44 ","05.28"
"레이드 즉시 완료가  버스팟 많아서 생긴거임????","ㅇㅇ ","110.14 ","05.28"
"근데  허수아비딜이나 솔플딜량은 ","ㅇㅇ ","223.38 ","05.28"
"너네 진짜 스마게가 즉완권 왜 낸지 모르냐","ㅇㅇ ","116.37 ","05.28"
"로아가 흥할 유일무이한 방법","ㅇㅇ ","124.51 ","05.28"
"하 유령선 본부캐 다돌았다","네온테트라 ","221.139 ","05.28"
"내일 패치 예상","puzzlewell "," ","05.28"
"그래도 스마게 좀 불쌍한 점","ㅇㅇ ","116.37 ","05.28"
"루황금상 어따쓰냐?","ㅇㅇ ","175.223 ","05.28"
"원한창술이","ㅇㅇ "," ","05.28"
"아스텔리아 요즘 나온 게임 맞음?","ㅇㅇ ","223.62 ","05.28"
"경쟁전 보상 최고점으로 보상얻는거야?","ㅇㅇ ","118.47 ","05.28"
"취미시간 돈으로 환원하지 말라는 쌀먹충 쉴드 특징","puzzlewell "," ","05.28"
"연습) 없데이트 씨발 뭔데?","ㅇㅇ ","211.47 ","05.28"
"념글에 금강선공 타캐 수십배딜 원리분석글","ㅇㅇ ","223.62 ","05.28"
"유령선 시발 대체언제 쳐바꿀건데요","11 ","123.254 ","05.28"
"캬 이번주 유령선 3캐릭 들어갔다 완전 갓겜!!","오스트랄로피테쿠스 ","112.184 ","05.28"
"레이드 장비재료 다 버리냐?","160 "," ","05.28"
"좆망겜하는데 배업글을 왜하노? ㅋㅋㅋㅋㅋ","선생님제발망겜좀하지마세요 "," ","05.28"
"유인원 씨ㅡ팔 새끼들아 유령선좀 그만와","ㅇㅇ ","58.231 ","05.28"
"mvp를 멀쩡한 딜미터기로 나올꺼라 생각하네 ㅋㅋㅋㅋ","ㅇㅇ ","121.175 ","05.28"
"내일 패치 예상","ㅇㅇ ","180.64 ","05.28"
"에어 이거 혹시 김치겜임??","ㅇㅇ ","58.231 ","05.28"
"지하철씨발보징어냄새지려버리네씨발","ㅇ.   ","175.223 ","05.28"
"주레 3개중에 하나라도 못깨면","ㅇ ","58.238 ","05.28"
"내일 초갓패치해도 ","ㅇㅇ ","211.246 ","05.28"
"욘보다 현실적인 호흡기 방안","ㅇㅇ ","59.22 ","05.28"
"없뎃이 업뎃으로 바뀌는 순간","ㅇㅅㅇ ","220.118 ","05.28"
"카제로스가 갓섭인 이유","ㅇㅇ ","58.120 ","05.28"
"우우! 아아!! 내일 인간된다 아ㅋㅋㅋ","ㅇㅇ ","223.33 ","05.28"
"내일패치 내용 들었다","ㅇㅇ ","125.182 ","05.28"
"시간만 존나 길게 잡아놓으면 갓패치 예정이냐?","ㅇㅇ ","211.207 ","05.28"
"점검 7시간 실화냐;","ㅇㅇ ","1.176 ","05.28"
"내일 나오는 MVP업데이트 요약","니겔룽 "," ","05.28"
"내일 섭종아니면 떡상이다 이게 마지막이다 진짜ㅋ","ㅇㅇ ","223.33 ","05.28"
"~의 정수 찬란한 지도조각 많이나오는 생활 머얌","ㅇㅇ ","58.231 ","05.28"
"창술사","주위 "," ","05.28"
"루페온은","주위 "," ","05.28"
"아싸 부캐도 주레입성한다 ^^","ㅇㅇ ","39.119 ","05.28"
"늒네인대","주위 "," ","05.28"
"(연습) 골드 100:700 팝니다  아ㅋㅋㅋ대기열","ㅇㅇ ","223.33 ","05.28"
"님들 회광반조현상 이라고 아시나요..?","ㅇㅇ "," ","05.28"
"[연습] 이그하람 100:600 팜 5천골단위","ㅁㄴㅇ ","59.6 ","05.28"
"보안패치로 3시부터 점검한다는데 왜 행복회로 돌리냐 ㅋㅋ","ㅇㅇ ","61.79 ","05.28"
"내일 욘이라며 아ㅋㅋㅋㅋ골드사로간다","ㅇㅇ ","223.33 ","05.28"
"로아코인 아직 안탄 흑우없제??","ㅇㅇ ","203.226 ","05.28"
"경고한다 내일 데빌헌터 상향 없으면 접는다","ㅇㅇ ","117.111 ","05.28"
"원정대레벨??그게 78이면 어느정도임??","ㅇㅇ ","211.33 ","05.28"
"유하~!","ㅇㅇ ","175.223 ","05.28"
"골드 빨리 사놔라","ㅇㅇ ","210.111 ","05.28"
"혹헬 매칭 돌렸더니 바드랑 디트랑 걸림 개꿀 ㅋ","ㅇㅇ ","65.19 ","05.28"
"아ㅋㅋㅋㅋ 지금 골드사는게 비트코인보다 좋다 떡상","ㅇㅇ ","223.33 ","05.28"
"아 이런거 안갈켜주는데 골드오늘사면 내일2배.3배다","ㅇㅇ ","223.33 ","05.28"
"20만골 사놨다 아 ㅋㅋㅋㅋㅋㅋㅋㅋㅋㅋㅋ","ㅇㅇ ","121.149 ","05.28"
"아ㅋㅋ매니아에서 30만골삿다","ㅇㅇ ","223.33 ","05.28"
"빨리 내일 됐으면 좋겠다 개씹꿀잼각 확정인디 ㅋㅋ","ㅇㅇ ","175.223 ","05.28"
"로아가 망해가는이유 패스오브엑자일 비교","ㅇㅇ ","183.102 ","05.28"
"지금 골드사서 되팔이해도 십이득임ㅋㅋ 내일 와","ㅇㅇ ","223.33 ","05.28"
"형이 분명히 말해준다 골드 지금 최대한 사놔라","ㅇㅇ ","175.223 ","05.28"
"카제로스섭 최고의 저능아집단 람쥐농장이 망한거면","ㅇㅇ ","117.111 ","05.28"
"골드 오늘 미리 사놔라 내일 떡상한다","ㅇㅇ ","175.223 ","05.28"
"원래 개발자들 다 나갔는데 희망이 어딨노 ㅋㅋㅋㅋㅋㅋㅋ","ㅇㅇ ","211.46 ","05.28"
"람쥐농장 근황","ㅇㅇ ","39.7 ","05.28"
"아ㅋㅋㅋㅋ어제살걸 매니아 골드시세올랐어 ㅃㄹ사자","ㅇㅇ ","223.33 ","05.28"
"어차피 내일 업데이트 병신이여도 난 로아할꺼임","ㅇㅇ ","104.131 ","05.28"
"람쥐농장 자리없자나","ㅇㅇ ","211.197 ","05.28"
"람쥐농장 갈 메리트가 전혀 없음","ㅇㅇ ","211.184 ","05.28"
"유인원 드립치는 분탕들 특징","ㅇㅇ ","211.179 ","05.28"
"크탈 존나비싸서 즉완도 못해","ㅇㅇ ","223.62 ","05.28"
"스마게가 초기 개발진들 다 짤랏음","ㅇㅇ ","211.184 ","05.28"
"아ㅋㅋㅋ내일 욘나온다며 다시깔로간다ㅋㅋ","ㅇㅇ ","223.33 ","05.28"
"나 람쥐농장인디 람쥐농장 망했음","ㅇㅇ ","211.184 ","05.28"
"람농이 망했을때 겜은 망한거다","ㅇㅇ ","110.70 ","05.28"
"죽은 아들 부랄 만져봤자 안살아난다.","ㅇㅇ ","121.132 ","05.28"
"청룡진 개념 너프안.txt","ㅇㅇ ","117.111 ","05.28"
"오랜만에 왔는데 게임 망하는도중 밸런스도 망했나봐?","ㅇㅇ ","117.111 ","05.28"
"못보던 고닉들 와서 쉴드치니 망한 것 체감 오지네","ㅇㅇ ","106.102 ","05.28"
"기공사 3단계 변신하고 장법갈기면 8000달더라","ㅇㅇ ","117.111 ","05.28"
"욘 지금 나와도 게임망했는데 ㅋㅋㅋㅋㅋㅋㅋㅋ","ㅇㅇ ","222.105 ","05.28"
