"dc_title","dc_writer","writer_ip","dc_date"
"프레이 데프트의 차이점이 오늘 정확이 드러났다.TXT","ㅇㅇ ","59.11 ","06.08"
"프줌마들 눈꽃 블랭크 만들기 대작전 가동 ㅋㅋㅋ","ㅇㅇ ","14.36 ","06.08"
"애드라 현질 얼마했는지는 이제 못봐?","호애앵 "," ","06.08"
"비디디나 프레이나 킹존에서 탑 버스나 타던 놈들인데 왜 편갈라싸움","ㅇㅇ ","175.28 ","06.08"
"프레이 진작에 맛이 갔었다","ㅇㅇ ","223.62 ","06.08"
"죧나 의외네 프레이는 안티 없을줄알았는데 ㅋㅋ","ㅇㅇ ","211.248 ","06.08"
"비디디 루키 lck시절만 비교하면 누가위냐??","ㅇㅇ ","223.62 ","06.08"
"응디디는 페까 마지막 방어선이라서 무너지면 안됨ㅋㅋㅋ","ㅇㅇ ","223.33 ","06.08"
"즙독들 즙은 아닌척 하는데 예전부터 적폐로 불리던 새끼들 다 퇴물됨","ㅇㅇ ","107.170 ","06.08"
"그냥 킹존그리핀만 lpl로편입하고 lck폐쇄시키자","ㅇㅇ ","1.240 ","06.08"
"Kt나 진에어나 원래 운빨로 이기던 팀들 아님?","ㅇㅇ ","1.252 ","06.08"
"킅마갤 스맵줌들이 먹음ㅋㅋㅋㅋ 입막음 지린다","ㅇㅇ ","211.246 ","06.08"
"1주차만 보면 롤드컵 세팀 어디일거 같냐","ㅇㅇ ","118.221 ","06.08"
"프레이 이름 떼고 제니트였으면 존재감 존나 없다고 욕먹었음","ㅇㅇ ","121.155 ","06.08"
"애초에 시발 9등팀이 원딜한명 영입했다고 달라지겠냐 ㅋㅋ","ㅈㅈㅈ ","211.255 ","06.08"
"근데 롤갤럼들은 왜 이악물고 선수 욕함?","ㅇㅇ ","117.111 ","06.08"
"아프리카 순위 예상이 제일 어려움 ㅅㅂ","ㅇㅇ ","61.75 ","06.08"
"솔직히 프레이온다고 뭐 기대한거 있음?","ㅇㅇ ","123.108 ","06.08"
"비디디 진에어전때도 폼 좋진 않았는데ㅇ","ㅇㅇ ","221.146 ","06.08"
"BDD =내년에 LPL수출되면 제2의 ROOKIE 되있을텐데 지금 실컷까","ㅇㅇ ","125.136 ","06.08"
"프레이는 뱅은커녕 데프트 룰러보다 아래임..","ㅇㅇ ","218.236 ","06.08"
"룰러 데프트는 상체가 좆똥이여도 3판에 1판꼴로는 캐리함","ㅇㅇ ","218.147 ","06.08"
"개욕쳐먹고 기량떨어져서 은퇴했으면 잠자코 유튜버나할것이지","ㅇㅇ ","220.72 ","06.08"
"응디맘들 역겨운게 지들이 쉴드치면 안까일줄암 ㅋㅋㅋ","ㅇㅇ ","211.194 ","06.08"
"프레이 딜찍 캐리력 부족한건건 팩트지","ㅇㅇ ","121.141 ","06.08"
"좆레이 담원갔었으면 더 잘했다고 하는게 프줌이냐 병신인가","ㅇㅇ ","104.131 ","06.08"
"현 시점 3강 뽑아보자","ㅇㅇ ","121.182 ","06.08"
"그리핀이랑 ig랑 해야되는데 ㅅㅂ 왜 하필 또 슼이냐고","ㅇㅇ ","221.152 ","06.08"
"프레이는 그냥 상체 못하면 캐리 안되는 원딜임.Feat데프트는","ㅇㅇ ","59.11 ","06.08"
"좆디디새낀 승강전 세체미임 ㅇㅇ","ㄷㄷㄷ ","1.224 ","06.08"
"좆레이 담원갔어야 된다고 울부짖는 프줌마 뭐냐 ㅋㅋㅋ","ㅇㅇ ","222.112 ","06.08"
"적어도 룰러 데프트엿으면 자야가 이거 데미지가 이상해요!!","ㅇㅇ ","218.147 ","06.08"
"그리핀 요즘 타잔 쵸비 소드 바이퍼 폼이 미쳤던데 누가이길수있을려나","ㅇㅇ ","125.136 ","06.08"
"슼마갤보다 더 역겨운 곳은 없다","ㅇㅇ ","104.131 ","06.08"
"갈리오서폿못쓸정도냐?","ㅇㅇ ","49.143 ","06.08"
"대퍼시절이 그립다","XD "," ","06.08"
"ㄹㅇ 킅이 한화 이길거라고 생각한것도 좀 우습네","ㅇㅇ ","45.50 ","06.08"
"17비디디 탈리야엿으면 피즈 6렙전에 개찢어놧움","ㅇㅇ ","39.7 ","06.08"
"그냥 구 킹존멤버들은 지금 다 퇴물아님?","ㅇㅇ ","14.7 ","06.08"
"쪼렙 일겜보다 고통이 있을까?","ㅇㅇ ","121.166 ","06.08"
"아프리카는 오더하는 선수가 없는 게 문제임 ㅅㅂ","ㅇㅇ ","61.75 ","06.08"
"슼이 lck,국제무대 평정하는거 올해까지일듯","ㅇㅇ ","175.223 ","06.08"
"본인 슼갈인데 비디디가 프레이보단 잘함..","ㅇㅇ ","218.236 ","06.08"
"킅은 긍데 범인 찾을것도 업지 안음?","ㄱㅅㄱㅅ ","49.167 ","06.08"
"데프트가 왜 세체원인지 오늘 프레이보면 알수있다","ㅇㅇ ","59.11 ","06.08"
"밥디디팬은 왜생긴거?","ㅇㅇ ","175.223 ","06.08"
"진지한 썸머 예측","ㅇㅇ ","121.167 ","06.08"
"담경기 존나재밋겟당 ㅇㅅㅇ","ㅇㅇ ","121.185 ","06.08"
"ㅇㅁㄷㅈ킅갈들 추하노ㅣㄱㅋㅋㅋ","칰아 "," ","06.08"
"프릴라가 뱅울프이긴게 프릴라가 잘해서이긴게 아니지 ㅋㅋ","ㅇㅇ ","218.147 ","06.08"
"프레이도 못한거 맞는데 왜 염병떨어 프줌새끼들아 ㅋㅋ","ㅇㅇ ","220.72 ","06.08"
"너네 1주차 경기력보니 LCK 경쟁력 있어보이냐?","ㅇㅇ ","59.6 ","06.08"
"응디디맘 슼갈 다 거르고 팩트","ㅇㅇ ","111.118 ","06.08"
"롤 프레임.  ","ㅇㅇㄹ ","168.126 ","06.08"
"프레이가 데프트 룰러 아래인게 오늘로 딱 증명됬지ㅇㅇ","ㅇㅇ ","59.11 ","06.08"
"좆디디맘들 페센세한테 비빌려고하네 ㅋㅋㅋㅋ 한때 세체미 루키도 ","ㅇㅇ ","58.77 ","06.08"
"담원이랑 그리핀 엄대엄하면 킹존절대강자네","ㅇㅇ ","1.240 ","06.08"
"님들 바이 멋어보이는데 지금 하기 괜찮아요?","ㅇㅇ ","180.228 ","06.08"
"한화애들 존나부럽다 ","ㅇㅇ ","1.227 ","06.08"
"눈꽃 솔랭아이디 머냐","iDOLM@STER "," ","06.08"
"Kt에서 잘하는 순위 알려줌","ㅇㅇ ","218.236 ","06.08"
"프레이한테 왜 교수님 교수님 이러냐? 뭐 롤강의라도하냐?","ㅇㅇ ","221.152 ","06.08"
"프레이 까는 새끼들","ㅇㅇ ","182.226 ","06.08"
"Kt는 왜 범인을 찾는거지? 원래못했는데","ㅇㅇ ","1.252 ","06.08"
"롤드컵 출전팀 예상 ) 1시드 킹존 2시드 그리핀 3시드 ??","ㅇㅇ ","104.236 ","06.08"
"비디디는 뇌가없고 오더가 없는 미드라서 모든플레이가 다 수동적임","ㄷㄷㄷ ","1.224 ","06.08"
"프줌마 : 프쨩 믿고 있었다구ㅠㅠ 이러다가 깃털에 발등찍힘 ㅋㅋㅋ","ㅇㅇ ","14.36 ","06.08"
"프줌마= 페독= 기인맘= 손뽕","ㅇㅇ ","218.147 ","06.08"
"난 도대체 이해를할수가없네. 응디디맘이 왜있는거야?","4부LCK "," ","06.08"
"프줌 역겹다고 하는 놈들 특","ㅇㅇ ","104.236 ","06.08"
"그리핀은 멘탈약한게 보임","iDOLM@STER "," ","06.08"
"교수님 선수생활 미련 있었으면 그냥 해외나 갈것이지","ㅇㅇ ","223.62 ","06.08"
"프레이 욕하는 새끼들은 경기는 보고말하냐?ㅋㅋㅋ","ㅇㅇ ","182.226 ","06.08"
"서머 예상 순위","ㅇㅇㅇㅇ ","125.189 ","06.08"
"프레이 까면 항상 나오는 말)뱅울프는 이겼다","ㅇㅇ ","121.155 ","06.08"
"근데 비디디가 프레이보다는 잘하던데...","ㅇㅇ ","218.236 ","06.08"
"이제 담원이 핀잡고 앞이 슼잡으면 비빔밥 완성이냐","ㅇㅇ ","222.109 ","06.08"
"응디디는 확실히 자기보다 피지컬떨어지고 못하는 미드한테강함","ㅇㅇ ","220.72 ","06.08"
"매라는 선수때부터 라인전을 개좆같이 못하잖아","ㄷㄷㄷ ","1.224 ","06.08"
"상윤&gt;&gt;&gt;&gt;&gt;교수님이였냐??","ㅇㅇ ","14.32 ","06.08"
"모든 선수들은 평생 욕먹을 운명이야","ㅇㅇ ","117.111 ","06.08"
"분위기 좋을것 같은팀","ㅇㅇ ","218.158 ","06.08"
"Kt는 이제 킹겐이 에이스인데 스맵 쓰면 감코가 정신나간거지","ㅇㅇ ","211.246 ","06.08"
"ㅇㅁㄷㅈ킅갈들 ㅈ댓노ㅋㅋㅋ","칰아 "," ","06.08"
"프줌마= 페독= 기인맘","ㅇㅇ ","218.147 ","06.08"
"비디디는 피즈상대로 존야 점멸 초시계 등으로 잘버텨준건데","ㅇㅇ ","125.136 ","06.08"
"프줌 씨발 무슨 용앞에서 정조준 긁었다고 프레이는 잘한다 ㅇㅈㄹ하던데","ㅇㅇ ","110.34 ","06.08"
"에포트 지금 매물로 풀리면 재평가가능성 큰거같은데","ㅇㅇ ","14.7 ","06.08"
"cs로 욕먹어서 억울하면 작년 트할 억울해 뒤지겠누","ㅇㅇ ","45.50 ","06.08"
"근데 그리핀은 머호가 헬스도 시키냐","ㅇㅇ ","58.76 ","06.08"
"Kt갈들 이제는 프레이 실드치니 프줌마라고 욕박노..","ㅇㅇ ","1.252 ","06.08"
"와이거뭐냐 ?","https:혼내드림 ","211.36 ","06.08"
"근데 오늘 8시 경기 담원그리핀전 어차피 그리핀이 이긴건데 봐야되냐","ㅇㅇ ","221.152 ","06.08"
"ㅋㅋ 양심에 손을 얹고 이번경기 비디디때문에 졌음???","ㅇㅇ ","59.11 ","06.08"
"스맵 아트 한타마다 휘두른거 다 헛손질이었단게 소름","ㅇㅇ ","211.246 ","06.08"
"프레이 맨날 킹존에서 버스만타는 원딜이엿는데 ㅇㅇ","ㅇㅇ ","218.147 ","06.08"
"보니까 눈꽃 이 새끼 파이크 할 줄 모르는 거 아님?","ㅇㅇ ","61.75 ","06.08"
"머리합니다 ㅡㅡ혼내드림 ㅡㅡ","https:혼내드림 ","211.36 ","06.08"
"비디디가 이길수 있는 주전미드 그레이스 내현 끝인듯","ㅇㅇ ","223.39 ","06.08"
"이라인업으로 팀꾸리면 LCK 몇등이냐??","ㅇㅇ ","39.7 ","06.08"
"킹존vs그리핀 평균외모 어느쪽이더나음?","ㅇㅇ ","1.240 ","06.08"
"킹존 그리핀 말고는 기대하지마라 애들아 다 노인정이다 슼이고 킅이고","ㅇㅇ ","50.7 ","06.08"
"아니 씨발 한화가 어떻게 이겼냐?","ㅇㅇ ","14.32 ","06.08"
"애초에 일본, 터키리거는 믿으면 안된다","ㅇㅇ ","218.159 ","06.08"
"담원 뭔가 잘나갈거 같다 싶었자만","sim981 "," ","06.08"
"이번 서머는 킹존 그리핀 1위 싸움이겠네","ㅇㅇ ","121.167 ","06.08"
"좆디디맘들 미드차이로 졋는데 팀탓 ㅋㅋㅋㅋ","ㅇㅇ ","58.77 ","06.08"
"아 빨리 그리핀 리라에서 얼마나 잘하는지 보고싶다","ㅇㅇ ","59.6 ","06.08"
"프레이 리그씹어먹는다는 프줌마들 ㅇㄷ?","ㅇㅇ ","175.223 ","06.08"
"작년서머부터 그리핀 경기는 매번 챙겨봤음","ㅇㅇ ","218.158 ","06.08"
"근데 비디디는 kt에 돈 많이받고 간거 아님?","ㅇㅇ ","110.70 ","06.08"
"4명에서라이즈덮칠때 눈꽃ㄹㅇ하이라이트","ㅇㅇ ","1.227 ","06.08"
"cs몇개 흘리는거 가지고 까는 애들은 걍 브실골임ㅇㅇ","ㅇㅇ ","59.11 ","06.08"
"롤갤형들 질문있어요!","ㅇㅇ ","147.47 ","06.08"
"스맵이 억제기 앞에서 풀발해서 피빠지고 뒤로 빼지만 않았어도 이겼다","ㅇㅇ ","211.246 ","06.08"
"진지하게 에포트가 파이크 더 잘함","ㅇㅇ ","210.108 ","06.08"
"그리핀한테 기대하는게 그리핀은 선수피지컬이 전부다 좋아","ㅇㅇ ","221.152 ","06.08"
"1세트 노궁 스카너 vs 2세트 노로밍 탈리야","ㅇㅇ ","110.70 ","06.08"
"눈꽃은 진짜 닉 개잘지은거에 감사해야됨","꼭곡이 "," ","06.08"
"애초에 16시즌부터 프레이는 캐리형 원딜이 아니엿음","ㅇㅇ ","218.147 ","06.08"
"비디디가 제일 불쌍하지 병신아 킹존때 바텀 존나 못해서 탈출했는데","ㅇㅇ ","59.11 ","06.08"
"진지하게 스멥이 서폿하는게 더 잘할듯","ㅇㅇ ","121.169 ","06.08"
"즙은 cs라도 잘쳐먹지 밥은 cs도 다놓치네 씹ㅋㅋㅋ","ㅇㅇ ","121.167 ","06.08"
"스맵은 이제 완전히 끝났어","ㅇㅇ ","211.246 ","06.08"
"눈꽃보다 못하는 서폿 누고?? 있으면 바꾸자 시발련들아","ㅇㅇ ","198.16 ","06.08"
"막말로 매라파이크정도만되도 kt가이겼다니까","ㅇㅇ ","218.148 ","06.08"
"킅도 개좆같은이유","ㅇㅇ ","1.233 ","06.08"
"프레이가 불쌍한거지 하필 가도 9등팀에 가서 에효","ㅇㅇ ","1.252 ","06.08"
"프래이는 그럼 서폿빨 원딜이네","ㅇㅇ ","110.70 ","06.08"
"슼갈이나 킅갈이나 같은 통신사 아니랄까봐","ㅇㅇ ","1.238 ","06.08"
"바이퍼vs테디 누가더잘함?","ㅇㅇ ","1.240 ","06.08"
"한화 근디 너무 개무시하는거 아이노ㅋㅋㅋ","ㅇㅇ ","45.50 ","06.08"
"좆디디맘들 페센세 음해하는거봐 ㅋㅋㅋㅋ","ㅇㅇ ","58.77 ","06.08"
"비디디자리에는 루키가 가도 개 좇망할껄? 이게 팩트임","ㅇㅇ ","59.11 ","06.08"
"지금까지 경기력보면 그 앞 존이 3위권일듯","ㅇㅇ ","218.158 ","06.08"
"플3 다4 듀오 돌아감?","ㅇㅇ ","175.197 ","06.08"
"느그킅이나 느그슼이나 좆같이 못하는건 똑같은데 왜 갈드컵염?","ㅇㅇ ","223.62 ","06.08"
"선수 폼 왜케 달라지는거임","ㅣ ","211.186 ","06.08"
"에포트도 풀리면 서로 모셔갈거 같은데","ㅇㅇ ","223.38 ","06.08"
"눈꽃은 그냥 제동빠처럼 bj멸망전에서 왕노릇이나하는게 본인의 위치임 ㅇㅇ","ㄷㄷㄷ ","1.224 ","06.08"
"눈꽃고평가이유= 서폿매물이 없어서","ㅇㅇ ","218.148 ","06.08"
"그냥 스코어 쓰고 스맵 서폿 시켜라 그게 정답이다 킅갈들아","ㅇㅇ ","198.16 ","06.08"
"프레이 하는거보니 제니트나 다를게 없는디","ㅇㅇ ","218.147 ","06.08"
"용쪽 바위게 시야는 안걸리게 못감??","ㅇㅇ ","121.157 ","06.08"
"원딜교체로 크트 바꾸려면 프레이 말고 뱅이나 룰러여야함","ㅇㅇ ","223.33 ","06.08"
"니들이 생각하는 지금 한체미는 누구냐","ㅇㅇ ","223.39 ","06.08"
"프줌마들 한화 기사에 가서 상윤 깐거 실화냐 ㅋㅋㅋㅋㅋㅋㅋ","ㅇㅇ ","14.36 ","06.08"
"밥디디랑 즙의 공통점과 차이점","dd ","121.138 ","06.08"
"정보) 응디디는 페즙보다도 못했다","ㅇㅇ ","210.178 ","06.08"
"하나만 물어보자 한화가 잘했냐 킅이 못했냐?","핀갈유동 ","211.36 ","06.08"
"KT는 ㄹㅇ 미아 왜 방출한거임??","ㅇㅇ ","39.113 ","06.08"
" 눈꽃은 너무심하더라","ㅇㅇ ","1.227 ","06.08"
"Kt는 9등이라 잃을게 없으니까 1등인 슼한테 깝치는거네","ㅇㅇ ","1.252 ","06.08"
"근데하난확실함","ㅇㅇ ","121.137 ","06.08"
"왠지 담원이 이길 것 같지 않냐ㅋㅋ","ㅇㅇ ","58.76 ","06.08"
"근데 ^9^새끼들은 왜 1557 까는거냐?","ㅇㅇ ","49.173 ","06.08"
"클리드 원맨팀 vs 노맨팀 엌ㅋㅋㅋ","ㅇㅇ ","121.167 ","06.08"
"프레이는 복ㄱ 해도 하필 왜 저런팀에 갔냐","ㅇㅇ ","218.159 ","06.08"
"킹존때 비디디가 유칼 쵸비 페이거 싹다 팼는데?","ㅇㅇ ","59.11 ","06.08"
"ㄹㅇ 뉴클리어가 프레이보다 잘하는데 담원 ㅇㅈㄹ하는 프줌들","ㅇㅇ ","110.34 ","06.08"
"아줌마 줌은 슼갈 너네고 시발련들아 보댕이 찢어뿔라","ㅇㅇ ","46.101 ","06.08"
"도원결의 시즌2 개웃기네 ㅅㅂㅋㅋㅋㅋㅋㅋㅋㅋㅋ","ㅇㅇ ","121.175 ","06.08"
"고릴라도 첨엔 못했어 ㅇㅇ 눈꽃도 떡상할 가능성있음 프레이랑함께면","ㅇㅇ ","125.136 ","06.08"
"눈꽃이 더샤이한테도 잘한다고 인정받은앤데","ㅇㅇ ","218.147 ","06.08"
"눈꽃 '그사건' 전에는 잘헀는데","ㅇㅇ ","211.197 ","06.08"
"눈꽃은 근데 왜 리그 시작전에 고평가 받은거임","ㅇㅇ ","45.50 ","06.08"
"이즈 좋은 원딜이지만 맛들리면 다른챔을 못함","ㅇㅇ ","1.252 ","06.08"
"응 엄티 눈꽃 써도 skt정도는 쳐바름","ㅈㅈㅈ ","211.255 ","06.08"
"병신들 여기서 와 싸우노 병신팀원들은 적시러 갔다","ㅇㅇ ","43.227 ","06.08"
"근데 데프트 무조건 KT나오려고 했음?","ㅇㅇ ","218.158 ","06.08"
"비디디가 순수실력만보면 무조건 lck 원탑임 이게 팩트","ㅇㅇ ","59.11 ","06.08"
"그와중에 그 아줌마들 또 눈꽃엄티욕하고 있네","ㅇㅇ ","175.223 ","06.08"
"아는놈은 다 알겠지만 킅팬덤 병신인거 스맵때문임ㅋㅋㅋ","ㅇㅇ ","222.104 ","06.08"
"시발 그냥 페이커가 다해라 그래!!!!!!!!!!!!!!!!!!!!!!!","ㅇㅇ ","221.152 ","06.08"
"킅은 미드가 아무것도 안하는데 이길수가 없지","ㅇㅇ ","58.77 ","06.08"
"어차피 8시경기가 진국임 ㅇㅇ","ㅇㅇ ","218.158 ","06.08"
"솔랭우리팀파이크가 전경기눈꽃처럼하면 어떡함?","ㅇㅇ ","1.240 ","06.08"
"눈꽃이 원래 포스트 메라급이긴 했어","ㅇㅇ ","123.108 ","06.08"
"롤잘알들 걱정이 현실로 ㅋㅋ 프레이 영입하면 머하냐고 눈꽃인데","ㅇㅇ ","178.62 ","06.08"
"킅졋다고 깝치는 슼갈병신드라 니네 내일 아프리카상대 ㅅㄱ","ㅇㅇㅇ ","121.137 ","06.08"
"1세트 스카너 r키 뺌 2세트 탈리여 r키 뺌 ㅋㅋㅋ","ㅇㅇ ","14.49 ","06.08"
"슼갈들아 그래도 진에어한테 비빈 팀은 개쳐바른다","ㅈㅈㅈ ","211.255 ","06.08"
"와 ㅅㅂ킅어땠길래 그러냐","핀갈유동 ","211.36 ","06.08"
"오늘 경기 비디디 슈퍼플레이.gif","ㅇㅇ ","14.36 ","06.08"
"좆디디 걍 딱봐도 지혼자 cs 질질흘렸는데 정글타령 ㅋㅋㅋㅋㅋㅋㅋㅋㅋㅋㅋ","ㄷㄷㄷ ","1.224 ","06.08"
"엄티 진에어때 스카너에 대해서 인터뷰 했잖아","ㅇㅇ ","1.238 ","06.08"
"1557 vs ^9^  어디가더못하노?","ㅇㅇ ","112.173 ","06.08"
"프레이데리고올거면 시 발 하다못해 매라라도데리고오던가","123 ","58.140 ","06.08"
"솔직히 2경기 스맵이 제일 사람같던데","ㅇㅇ ","211.255 ","06.08"
"슼은 심지어 영입전때 제일 잘나가던 정글러 하루도 먹었는데","ㅇㅇ ","221.152 ","06.08"
"밥디디 탈리야 로밍 0회 시발 ㅋㅋㅋㅋ","ㅇㅇ ","121.167 ","06.08"
"팩트)) 작년에는 비디디가 유칼 쵸비 개강간했다 ㅇㅇ","ㅇㅇ ","59.11 ","06.08"
"킹존 말고는 기대할 팀이 없네 다 병신됏네 LCK","ㅇㅇ ","178.62 ","06.08"
"^1557^ ^9^의 공통점","ㅇㅇ ","121.137 ","06.08"
"근데 KT는 욕심이 너무 과하다","ㅇㅇ ","36.39 ","06.08"
"kt는 투신 바지잡고 매달렸여야지","ㅇㅇ ","218.158 ","06.08"
"조커가 정글러에서 포변했는데 원조 조커도 포변하면 안되냐","ㅇㅇ ","117.111 ","06.08"
"마지막에 교수님 당황한건가","ㅇㅇ ","117.111 ","06.08"
"응디디, 프리나가 롤갤에서 유독 실드 받는 이유.fact","ㅇㅇ ","14.36 ","06.08"
"2분 바위게로 억지로 싸우게 해야지","ㅇㅇ ","14.37 ","06.08"
"kt 개못해 ㅎ","SKT호날두문재인박지성 ","175.201 ","06.08"
"애초에 프레이가 캐리하는 원딜은 아닌데 ㅋㅋㅋ","ㅇㅇ ","223.33 ","06.08"
"개브론즈새끼들 좆디디가 라인전 cs 반반간건 디나이를 못해서가 아니야 ㅋ","ㄷㄷㄷ ","1.224 ","06.08"
"띵구 닉네임 아는사람","ㅇㅇ ","121.153 ","06.08"
"미드 포탑에서 탈리야 무리하다 짤려서 스노우볼 굴러간거 아님 ?","ㅇㅇ ","14.49 ","06.08"
"KT 왜 범인 찾냐?","ㅇㅇ ","14.37 ","06.08"
"바위게 패치 롤백 안하면 리그 ㄹㅇ 망할듯","ㅇㅇ ","125.180 ","06.08"
"삼고초려 좋아하네 ㅋㅋ 지랄도 너무 지랄","ㅇㅇ ","118.41 ","06.08"
"킅 = LCK 연봉 2위 승강전 레전드팀","ㅇㅇ ","211.36 ","06.08"
"소환:kt는 씹을가치도없다 차라리 껌을씹겠다","ㅇㅇ ","223.62 ","06.08"
"프레이보다 에이밍이 더잘하는건 팩트지","ㅇㅇ ","1.227 ","06.08"
"소환 인터뷰 어디서 보냐","ㅇㅇ ","111.118 ","06.08"
"근데 대체 갤에 좆디디맘이 어딨음?","ㅇㅇ ","106.102 ","06.08"
"킹존때 비디디가 유칼 쵸비 개털었는데 그때 경기 안본 급식새끼들","ㅇㅇ ","59.11 ","06.08"
"아니 다 병신인데 뭘 골라","ㅇㅇ ","223.38 ","06.08"
"1557  vs  ^9^","ㅇㅇ ","112.173 ","06.08"
"오늘 경기로 더욱 확실해진 서머순위.real","ㅇㅇ ","211.230 ","06.08"
"프레이도 그닥이던데","ㅇㅇ ","218.147 ","06.08"
"나는 준일하다 얜 누구임?","ㅇㅇ ","112.149 ","06.08"
"한타도 안한경기에 원딜을 까네 ㅋㅋㅋ","ㅇㅇ ","106.102 ","06.08"
"8시까지만 하는 칼망호","ㅇㅇ ","121.147 ","06.08"
"킅이 슼보단 낫지","ㅇㅇ ","46.101 ","06.08"
"ㅋㅋㅋㅋ kt가 이겼으면 껌씹는거 안봤을텐데 ㅋㅋㅋㅋㅋㅋㅋㅋㅋ","ㅇㅇ ","221.145 ","06.08"
"인터뷰 껍씹는거 저거 제재사유 아님?","ㅇㅇ ","221.151 ","06.08"
"kt 등신팀 진에어잡고 설레발치더니 ㅋ","ㅇㅇ ","211.246 ","06.08"
"담원도 2패 스타트하겠네","ㅇㅇ ","223.62 ","06.08"
"오늘프레이 어떗음??","Jerry "," ","06.08"
"남자면서 언니라고 하는 새끼들 아가리 날려도 무죄냐?","ㅇㅇ ","223.62 ","06.08"
"설레발치는건 KT나 SKT나 똑같노 ㅋㅋㅋ","ㅇㅇ ","180.229 ","06.08"
"프줌들 미친것인가 ㅋㅋㅋㅋㅋ 딴데는 프레이 필요 없으니까 안부른건데","ㅇㅇ ","121.155 ","06.08"
"왜 킅이 강팀이라는 생각을 했지","소울 스큐어 "," ","06.08"
"서포터가 어려운게 서폿말고 딴라인도 할줄알아야됨","ㅇㅇ ","119.194 ","06.08"
"너무 범인찾지마라 진짜 ","ㅇㅇ ","219.254 ","06.08"
"[-REAL-]이글아래에 구글원스토어 5천원쿠폰있슴 2일남음","AM ","220.124 ","06.08"
"현실을 받아들여라 프레이보다 못하는 원딜없어 ","ㅇㅇ ","223.33 ","06.08"
"프레이 2경기에 이즈 벤됐을때 눈빛존나 흔들리더라","ㅇㅇ ","218.158 ","06.08"
"sb가 스베누임?","멜리사라 "," ","06.08"
"크트 답 없다 플옵은 ㅈㅅㄴ","ㅇㅇ ","46.101 ","06.08"
"눈꽃 팀적인 문제일수도 잇다.","ㅇㅇ ","218.147 ","06.08"
"비디디 작년에 한체미 아니었음?? 왤캐 ㅂㅅ된거임?","ㅇㅇ ","59.11 ","06.08"
"다이아 듀오제한 몇티어까지임?","ㅇㅇ ","175.197 ","06.08"
"신기한게 이렐 라이즈 블라디는 서로 상성 관계임 ㅋㅋ","ㅇㅇ ","116.36 ","06.08"
"내가 대회에 나간다면 탑은 무조건 스맵 박는다.","동네복서 ","114.204 ","06.08"
"지금 skt는 제일 잘한다는 놈들만 모아놨는데 지는게 개쪽이지ㅋ","ㅇㅇ ","221.152 ","06.08"
"프레이 영입했다고 팀이 바뀔거라고 생각하는 빢대가리 킅갈들 ㅋㅋㅋㅋㅋㅋㅋ","ㅇㅇ ","112.151 ","06.08"
"KT는 비디디가 맛이간게 제일 크지 않을까?","ㅇㅇ ","123.108 ","06.08"
"KT는 일단 서부시험  통과 못했네","ㅇㅇ ","36.39 ","06.08"
"아니 뉴클리어가 프레이보다 잘하는데 뭔 담원이요 ㅋㅋㅋㅋㅋㅋㅋㅋㅋㅋㅋ","ㅇㅇ ","218.236 ","06.08"
"응디맘들아 존나 추하다 양념그만치고 다른선수 정신병원좀 그만보내","ㅇㅇ ","211.194 ","06.08"
"탈리야로 피즈 cs못먹게하는게 가능함?","ㅇㅇ ","1.227 ","06.08"
"킅갈새끼들 좆같이 못해놓고 인터뷰 껌씹었다고 지랄염병하네 ㅋㅋㅋㅋㅋ","ㄷㄷㄷ ","1.224 ","06.08"
"상윤이 눈꽃손절친게 장기적으로 맞는판단이었네;;","ㅇㅇ ","39.113 ","06.08"
"서열정리))) 샌박 &gt;&gt;&gt; 한화 &gt;&gt;&gt; Kt &gt;&gt;&gt; 진에어 &gt;&gt;&gt; skt","ㅇㅇ ","112.173 ","06.08"
"ㄹㅇ 페교수님 전성기가 얼마나길엇는데","ㅇㅇ ","39.7 ","06.08"
"눈꽃 아마때는 개잘했으니깐 상윤이랑 ㅋㅋ ","ㅇㅇ ","223.38 ","06.08"
"즙은 걍 그레이스한테도 개졷발리는데  ㅋㅋ","ㅇㅇㅇ ","121.137 ","06.08"
"오늘 프레이 슈퍼플레이.jpg","ㅇㅇ ","14.36 ","06.08"
"엘씨게이 버러지새끼들은 칼바람으로 대회해도 10분당 1킬나올듯","ㅇㅇ ","125.180 ","06.08"
"담원도 드럽게못하든데ㅋㅋ","ㅇㅇ ","218.148 ","06.08"
"뉴클리어도 프레이보다 더 잘하는데 이젠 담원타령이네 ㅋㅋㅋ","ㅇㅇ ","223.33 ","06.08"
"프레이 복귀할때만해도 포텐터져야 67위라 예상했는데","ㅇㅇ ","182.226 ","06.08"
"프레이 자야는 안시키는게 그냥 좋음","ㅇㅇ ","117.111 ","06.08"
"중반부터봣지만 계속쳐짤린 엄티랑 맨땅헤딩 오지던 눈꽃 잘못","dd ","211.186 ","06.08"
"담원이 호잇 풀어주면 kt 진짜 롤드컵갈만한데","ㅇㅇ ","183.108 ","06.08"
"서폿 vs 원딜  둘중 누가 더 중요 포지션?","ㅇㅇ ","218.147 ","06.08"
"눈꽃말고 그냥 챌린저서폿 아무나 데려와도될거같은데","ㅇㅇ ","219.254 ","06.08"
"골드정도되면 500등 그마한테도 실력 인정받을수 있더라.fact","쿠로세이더 "," ","06.08"
"님들 럭서폿좋음","ㅁㄴㅇ ","61.255 ","06.08"
"제발 좆디디 페센세랑 비비지마라 ㅋㅋㅋㅋ","ㅇㅇ ","58.77 ","06.08"
"넛구커즈 재평가들어가야지않냐? 응디디 칸 끼고 상체압도함 ㄷㅇ","123 ","58.140 ","06.08"
"SKT = Semi KT","ㅇㅇ ","180.229 ","06.08"
"탈리야 피즈 6전에는 탈리야가 개텀 ㅇㅇ","ㅇㅇ ","1.252 ","06.08"
"껌 씹는거 외국에서도 버릇 업는거 맞는데","ㅇㅇ ","175.223 ","06.08"
"이때다 싶어서 기어나오는 즙독들 보소 ㅋㅋㅋ","ㅇㅇ ","14.36 ","06.08"
"슼은 얼마나 쓰레기인거냐 저런 킅도 진에어 2대0 잡앗는데","ㅇㅇ ","46.101 ","06.08"
"눈꽃은 아마에서 대체 왜 유명했던 거냐","ㅇㅇ ","220.73 ","06.08"
"강팀되려면 서포터가 잘해야됨","ㅇㅇ ","119.194 ","06.08"
"비디디는 그냥 혼자서 아무것도 못하는새끼임","ㄷㄷㄷ ","1.224 ","06.08"
"서열정리))) 샌박 &gt;&gt;&gt; 한화 &gt;&gt;&gt; Kt &gt;&gt;&gt; 진에어 &gt;&gt;&gt;SKT","ㅇㅇ ","112.173 ","06.08"
"제발얘들아부탁이야싸우지마제발","굿크크크 "," ","06.08"
"담원이 프레이 영입했으면 딱 18킹존느낌 냈지 ㅇㅇ","ㅇㅇ ","14.52 ","06.08"
"슼은 진짜 얼마나 못해진거냐??","ㅇㅇ ","223.62 ","06.08"
"오늘은 경기 움짤없네","ㅇㅇ ","211.246 ","06.08"
"정글이 미드를 그렇게 봐줬는데 캐리못한 새끼는?","ㅇㅇ ","165.132 ","06.08"
"킹겐이 파이크해야지 혜지보고 시키고 앉아있노","ㅇㅇ ","45.50 ","06.08"
"비디디는 cj때부터 2부따리정도 기량이었음","ㅇㅇ ","223.62 ","06.08"
"아니 스코어 게임은 못 나오는데 트래쉬토크에는 나오네ㅠ","ㅇㅇ ","112.152 ","06.08"
"Lck는 킹존 빼고 다 게이메타인 느낌인데 안그럼?","ㅇㅇ ","59.6 ","06.08"
