"dc_title","dc_writer","writer_ip","dc_date"
"페이커는 그냥 은퇴햇어야 안까이지","ㅇㅇ ","61.82 ","06.08"
"매국노는 진정 페즙이랑 슼갈 너네다","ㅇㅇ ","104.131 ","06.08"
"진에어한테도 비비는 좆슼상대로 진땀승해놓고 염병하네 ㅋㅋ","ㅇㅇ ","39.117 ","06.08"
"듀오하자고 씨발새끼들아 닉넴적어","ㅇㅇ ","175.119 ","06.08"
"페이커 나이면 이제 고령이야","ㅇㅇ ","211.47 ","06.08"
"ㅋㅋㅋㅋ 루키가 참교육 해줘야됐는데 운좋게 ig피해서 우승하니 좋노 ㅋㅋ","ㅇㅇ ","58.77 ","06.08"
"페이커는 캡스한테 이기고 오라고 해 ㅇㅇ","ㅇㅇ ","122.254 ","06.08"
"G2 약점이뭐임","스크린샷 "," ","06.08"
"캡스 어그로 속는 놈은 없고 속이는 놈만 있노..","ㅇㅇ ","14.50 ","06.08"
"여기 단톡방있나 ㅋㅋ 뭔 개소리피셜ㅋㅋㅋ","ㅇㅇ ","115.93 ","06.08"
"년도별 페이커 정리","맘스타치 "," ","06.08"
"좆투는 rng만나면 아마 맞아뒤질거임","ㅇㅇ ","122.32 ","06.08"
"슼갈들 또또 꿈꾼다 현실은 프나틱한테도 정리당함 ㅅㄱ","ㅇㅇ ","122.254 ","06.08"
"캡스가 퍽즈보다 잘하는거는 확실함?","ㅁㅁ ","58.120 ","06.08"
"친구랑 토론중인데 판결좀","시노부o "," ","06.08"
"매국노 이완혁때문에 유럽한테 국가망신당하네","ㅇㅇ ","221.158 ","06.08"
"G2에서 페이커 그나마 존중하는게 퍽즈임","ㅇㅇ ","218.147 ","06.08"
"선생님들 팀랭 돌리면 상대팀도 무조건 팀랭인가요?","ㅇㅇ ","223.62 ","06.08"
"그 갈들 왜케 쒸익 쒸익 대노","ㅇㅇ ","223.33 ","06.08"
"페이커가 캡스보다 못한건 씹팩트지 ㅋㅋ","123 ","221.150 ","06.08"
"그전에는 왜 g2같이 나대는팀이 없었나 생각해보니","ㅇㅇ ","115.93 ","06.08"
"실골 롤할새끼없냐 지금바로","ㅇㅇ ","175.119 ","06.08"
"이러고 롤드컵때 개좆발리면 시원할듯","ㅇㅇ ","125.180 ","06.08"
"애들아 다2면 잘하는거냐 ?","ㅇㅇ ","211.222 ","06.08"
"캡스 ㄹㅇ 듣보잡이 한시즌 반짝한다고 나대는거 역겨움 ㅋㅋㅋ","ㅇㅇ ","223.62 ","06.08"
"캡스피셜) 페이커는 사일러스 줘도 됨","ㅇㅇ ","104.131 ","06.08"
"G2 구단주 오셀롯 피셜)) 페이커는 커리어만 좋은선수다.","ㅇㅇ ","218.147 ","06.08"
"롤할떄 모니터 144랑 60이랑 차이크냐?","ㅇㅇ ","112.169 ","06.08"
"아니 근데 캡스나 원더면 몰라도 퍽즈 새끼가 왜 이빨터냐?","ㅇㅇ ","14.36 ","06.08"
"캡스가 즙이랑 가장 대비되면서 잘하는 미드긴하지","ㅇㅇ ","122.32 ","06.08"
"유럽이 북미보다쌘듯 바이탈리티도 유럽아니냐 ㅋㅋㅋㅋ","ㅇㅇ ","116.34 ","06.08"
"Skt 미드 캡스로 교체하면 롤드컵 컨텐더로 부상함?","ㅁㅁ ","58.120 ","06.08"
"롤드컵도 못먹은 G2가 나대는게 왜 이상한거냐?ㅋㅋ","ㅇㅇ ","211.246 ","06.08"
"캡스가 최소 국제대회에서 3회 이상 주도적으로 우승해오면 인정해줌","123 ","221.150 ","06.08"
"뇌피셜이 난무하네","ㅇㅇ ","121.153 ","06.08"
"그만 좀 징징대 병신같어 너네 국제대회 나가서 처맞기만 해놓고","ㅇㅇ ","178.128 ","06.08"
"캡스 ㄹㅇ 누군지도 몰랏는데 나대노 ㅋㅋㅋㅋ","ㅇㅇ ","58.77 ","06.08"
"갑자기 병신들 존나 기어나오노","ㅇㅇ ","121.171 ","06.08"
"팩트: 결국엔 lck팀 중에서 아무나 롤드컵 우승하면 모든게 풀린다","ㅇㅇ ","112.155 ","06.08"
"탈리야 죤내 쎄다 ㄹㅇ","ㅇㅇ ","27.113 ","06.08"
"한화는 서머도 볼것도없이 특정시기에 치고나가다 6위딱?","ㅇㅇ ","122.32 ","06.08"
"g2코치피셜 ) lck와 skt에대하여 .txt","ㅇㅇ ","125.176 ","06.08"
"LCK가 멸망한 이유","ㅇㅇ ","112.169 ","06.08"
"롤드컵도 못들어본 병신들이 깝치는거 왜 반응함 ㅋㅋㅋ","ㅇㅇ ","223.62 ","06.08"
"아 시발 노트북으로 겜 못하겠네","ㅇㅇ ","182.212 ","06.08"
"아무리 즐겜해도 프로가 솔랭승률40퍼가 말이되냐","ㅇㅇ ","61.82 ","06.08"
"탑챔프 추천좀","해파 "," ","06.08"
"페이커는 늙어서 못해진게 아님","ㅇㅇ ","211.38 ","06.08"
"사일 카운터는 대체뭐냐","스크린샷 "," ","06.08"
"캡스한테 즙을 처비비는거겟지 ㅋㅋ  누가누굴 ㅋㅋ","ㅇㅇ ","121.137 ","06.08"
"야 씨발 갑자기 로그인 왜안되냐","ㅇㅇ ","116.121 ","06.08"
"왤케 샤코하는 놈들 중에 인방하는 애들이 많은거같지","결핍 "," ","06.08"
"롤 씨발","ㅇㅇ ","182.228 ","06.08"
"캡스가 페즙한테 비비기엔 좆도 이르지 ㅋㅋ","123 ","221.150 ","06.08"
"근데 13때는 페이커가 피지컬 원탑아니였나","맘스타치 "," ","06.08"
"요즘 1티어 정글 누구있어?","ㅇㅇ ","121.178 ","06.08"
"캡스출처 찾을 필요가 있냐 근데?? 해외방송만 가봐도","ㅇㅇ ","178.128 ","06.08"
"솔직히 sk우승은 별 관심없었고 ig쳐발린게 개꿀이었지","ㅇㅇ ","115.93 ","06.08"
"느그슼 스프링 뽀록유승하고 바로 강등가는 레전드기록세우네","ㅇㅇ ","121.137 ","06.08"
"애쉬보다 징크스가 더어렵지않냐","ㅇㅇ ","58.121 ","06.08"
"불축시비르 크로마씹역대급이네 ㅋㅋㅋ","⊙⊙ "," ","06.08"
"캡스가 페이커 깠다고? 출처좀","ㅇㅇ ","112.155 ","06.08"
"롤드컵 조별에 ig g2 풍부 나머지한팀붙어있으면 누가 8강가냐","ㅇㅇ ","121.175 ","06.08"
"홍어쵸비 피부 존나 상했던데","ㅇㅇ ","223.33 ","06.08"
"정글,서폿 피들 룬 뭐드냐","ㅇㅇ ","119.70 ","06.08"
"피해망상잇나 슼을 뭘 억지로 까 므시 4강따리 하고 진에어랑 자강두천","ㅇㅇ ","178.128 ","06.08"
"캡스 박수치는거 개웃기네 ㅋㅋㅋㅋ","않이 ","112.168 ","06.08"
"캡스는 진짜 &quot;혼모노&quot;가 맞긴 한듯","123 ","221.150 ","06.08"
"오늘 부캐노말에서 난 다이아다 소리 들어봄","공팔일일 "," ","06.08"
"g2 퐁부한테  좆발린건 뭐냐","ㅇㅇ ","180.231 ","06.08"
"G2랑 캡스가 우승한 이유가잇네 슼이 거품빈집인거 유일언급","ㅇㅇ ","121.137 ","06.08"
"나만 그랫나? 슼갈들이 ㅈ같앗어도 msi때","ㅇㅇ ","115.21 ","06.08"
"초비가 진짜 큰경기 새가슴 아니냐","ㄹㄹ ","211.250 ","06.08"
"요즘 탱커도 스테락 가야함","ㅇㅇㅅㅇ ","1.225 ","06.08"
"스크 억지로까는거 존나웃기네ㅋㅋ","ㅇㅇ ","125.176 ","06.08"
"저게 진짜면 슼마갤년들이 가만히 있겠노 ㅋㅋㅋㅂㅅ","ㅇㅇ ","115.93 ","06.08"
"퐁부,ig 한테 전패당한 팀이 롤드컵 가봤자;;","롤갤망령 "," ","06.08"
"15즙 좆도 아냐 과대평가 좀 하지마 그 자리에 즙 없어도","ㅇㅇ ","178.128 ","06.08"
"근데 ㄹㅇ 슼 우승스킨은 건질거 하나가없냐","ㅇㅇ ","112.151 ","06.08"
"대회 야스오랑 솔랭 야스오랑 많이 다른거같음","ㅇㅇ ","182.215 ","06.08"
"페이커 아무리 까여도 통장보면 행복하겠지?","ㅇㅇ ","124.153 ","06.08"
"이번엔 킹존 샌박 그리핀 3파전임 반박시 즙독슽갈","ㅇㅇ ","121.137 ","06.08"
"캡스 로이조랑 존나 닮았다 ","ㅇㅇ ","180.231 ","06.08"
"머래 병신들이 원래 한 경기마다 재평가하는 곳이 여기인데 티내나","ㅇㅇ ","178.128 ","06.08"
"솔직히 베이비 캡스면 선방한거지","ㅇㅇ ","223.33 ","06.08"
"형들 이블린 qqq때 평 안써짐?","ㅇㅇ ","211.117 ","06.08"
"근데 g2인터뷰가 위험한게","물냉면 "," ","06.08"
"친구랑 듀오해주는데 뭐 또 받아야하나","ㅇㅇ ","223.62 ","06.08"
"캡스가 먼말했는데 출처가 어디노","ㅇㅇ ","115.93 ","06.08"
"이 미친눔들아 리그 초반에 한두경기로 뭘 평가하냐","123 ","221.150 ","06.08"
"그리핀이랑 킹존이 우승후보임","ㅇㅇ ","125.176 ","06.08"
"페이커18년도까진 외국서 성역화였는데 지금은아님","Deft ","39.7 ","06.08"
"중반 운영법을 모르겠다.","ㅇㅇ ","210.117 ","06.08"
"G2 관계자 피셜: LEC 팬들은 SKT를 극도로 혐오한다","ㅇㅇ ","118.219 ","06.08"
"꼬우면 우승하던가 슼갈 시발련들아","ㅇㅇ ","178.128 ","06.08"
"칼바람 소나잡고 지네 앰뒤 팀원새끼들","ㅇㅇ ","182.228 ","06.08"
"캡스가 할말한거지 과대평가 선점빨 빈집빨 맞는데","ㅇㅇ ","121.137 ","06.08"
"난 스맵호감임 계속 봤으면 좋겠다 ㅋㅋ","ㅇㅇ ","114.199 ","06.08"
"온전한 스킨은 재조합 못함??","ㅇㅇ ","27.113 ","06.08"
"2티어 승률 53퍼 이기면18점 지면17점 mmr씹창인거?","ㅇㅇ ","112.151 ","06.08"
"슼갈 존나 많네 시발 ㅋㅋ 언제부터 씹선비스럽게 그런거에 반응햇다고","ㅇㅇ ","178.128 ","06.08"
"원래 후보땐 경기장 적응이 안되서 제실력 나오기 힘들지","ㅇㅇ ","112.169 ","06.08"
"LEC 미친놈들 ㅋㅋㅋㅋㅋㅋㅋㅋㅋㅋㅋㅋㅋㅋㅋㅋ","ㅇㅇ ","222.100 ","06.08"
"베이비 캡스나만빡치냐","ㅇㅇ ","110.15 ","06.08"
"스웨인서폿만하면 승패가 너무 명확함","ㅇㅇ ","121.164 ","06.08"
"6년만에 처음으로 골드2 찍엇다 ㅠㅠ","너구리논땅 ","110.70 ","06.08"
"쇼메이커 객관적으로 어느정도냐?","ㅇㅇ ","210.105 ","06.08"
"페이커 해외서 고평가 옛말이지 이번에 빈집뽀록낫자너","ㅇㅇ ","121.137 ","06.08"
"발칸은 터키가서도 갱맘이랑 혐한 조장하네 ㅋㅋ","ㅇㅇ ","211.179 ","06.08"
"아니 씨발","Qwer "," ","06.08"
"난 이번 시즌 킹존 우승확률이 젤 높다 봄.","ㅇㅇ ","211.44 ","06.08"
"슼갈새끼들 킹존 그리핀은 커녕 젠지 kt도못이기지 ","ㅇㅇ ","121.137 ","06.08"
"캡스가 말한건 페이커가 세체미급 아니라는거지 역체미 부정은 안함","ㅁㅁ ","58.120 ","06.08"
"팀운이 너무 좋아 고민이다","... ","121.191 ","06.08"
"폼다떨어진 마이클조던 한테","ㅇㅇ ","223.62 ","06.08"
"근데 캡스 옛날별명 베이비페이커 누가붙여준거임?","ㅇㅇ ","112.155 ","06.08"
"이번 섬머시즌 순위예측","ㅇㅇ ","125.176 ","06.08"
"라스칼 존나 잘하네 시발","ㅇㅇ ","125.135 ","06.08"
"역체팀은 슼 맞지","물냉면 "," ","06.08"
"야 원래 갱플이 레넥 갖고 노냐?","ㅇㅇ ","118.129 ","06.08"
"rng 엄청 잘하는데","ㅇㅇ ","211.246 ","06.08"
"바루스 스킨 설원특공대 정복자 암흑의 별","ㅇㅇ ","125.190 ","06.08"
"캡스의 말에 대해서 FACT체크 들어가자","123 ","221.150 ","06.08"
"서머 킹존우승 1시드직행 2등 그리핀 2시드 직행","ㅇㅇ ","211.52 ","06.08"
"아니 니코 밴좀 하지마","ㅇㅇ ","183.101 ","06.08"
"닝 요즘 욕먹는 이유가 뭐임 ??","ㅇㅇ ","182.222 ","06.08"
"폰겜 할만한거 머있냐","ㅇㅇ ","121.164 ","06.08"
"야 갑자기 로그인이안되는데 해킹당하는거냐??","ㅇㅇ ","219.254 ","06.08"
"압둘알리 구독자 하루에 만명 넘게 느네 ㄷㄷ","ㅇㅇ ","117.111 ","06.08"
"캡스 관심받으려고 페이커 이용해서 어그로끄네","ㅇㅇ ","223.62 ","06.08"
"롤망호 뜻이 머야 얘들아 ??","예루루 "," ","06.08"
"도파 분명 Aind 말고 한국섭 비밀계정잇는데","ㅇㅇ ","116.39 ","06.08"
"브루저 메타인 지금 뽀삐 사기인거 같은데","ㅇㅇㅅㅇ ","1.225 ","06.08"
"지금 경기력은 그리핀이랑 킹존 투탑","ㅇㅇ ","125.176 ","06.08"
"국뽕년들 해외리그 수준 낮다고 6년을 조롱해놓고","ㅇㅇ ","175.120 ","06.08"
"슼갈들아 진에어 그게 이긴거냐? ㅋㅋ 사실상 2대떡 경기력","ㅇㅇ ","121.137 ","06.08"
"페이커는 원래 해외에서 더 고평가하는데 뭔개소리노ㅋㅋ","ㅇㅇ ","115.93 ","06.08"
"슼 롤드컵4강 가능하냐","ㅇㅇ ","39.114 ","06.08"
"리신으로 당구 못하면 하지 말아야해?","NoGuarder "," ","06.08"
"야 인게임 비속어 필터 푸는 명령어 아는사람","ㅇㅇ ","58.235 ","06.08"
"아트록스는 버프좀 먹여야됨","ㅇㅇ ","118.34 ","06.08"
"당장 lck판 스타성있는선수 누구있냐","ㅇㅇ ","112.151 ","06.08"
"정보)2019 LCK 서머 등장 챔피언","ㅇㅇ ","210.117 ","06.08"
"베인 좆사기캐년","ㅇㅇ ","223.33 ","06.08"
"슼갈들 부들대노 ㅋㅋ 즙 과장된 선수라는 한 마디에","ㅇㅇ ","178.128 ","06.08"
"근데 6년차 프로한테 과장된 선수다~~","ㅇㅇ ","125.176 ","06.08"
"캡스 99년생이란다 이해해줘라","123 ","221.150 ","06.08"
"좆롤갤은 한번도 롤얘기하는적을 본적이 없음","ㅇㅇ ","118.219 ","06.08"
"그나마 즙이라도 있어야 즙까는 재미로 롤 챔 보는거잖아","카타기리에리카 "," ","06.08"
"sola9 &lt;&lt; 이새기 애미디짐 ㅇㅇ","ㅇㅇ ","116.47 ","06.08"
"해외가 역시 선진국이라 그런가 잘 하네 그래 밟을때 밟아줘야지","ㅇㅇ ","178.128 ","06.08"
"즙 접으면 롤안봄","ㅇㅇ ","218.152 ","06.08"
"G2가 선을 넘긴 뭘넘어 ㅋㅋㅋㅋㅋㅋㅋㅋ","ㅇㅇ ","211.185 ","06.08"
"근데 어차피 g2가 막 lck 욕하는거","ㅇㅇ ","112.155 ","06.08"
"Mlxg 이새끼는 뭐하냐?","ㅅㅅ ","110.15 ","06.08"
"7년차 폼다떨어진 프로선수한테 과장이라니 ㅋㅋㅋㅋㅋ","ㅇㅇ ","223.62 ","06.08"
"즙 은퇴한다고 뭘 망해","ㅇㅇ ","39.114 ","06.08"
"즙 과장된 선수 맞자너","ㅇㅇ ","178.128 ","06.08"
"캡스근데 왜 G2에 있는거냐?","ㅁㅁ ","119.69 ","06.08"
"어 뭐야 다보고 있는거야 ?","카타기리에리카 "," ","06.08"
"2d아이돌에 돈쓰기 vs 3d아이돌에 돈쓰기","ㅇㅇ ","220.127 ","06.08"
"이거 갤러리?? 는 내가 생각할때 참 조은게 머냐면","예루루 "," ","06.08"
"라인별로 챔하나씩연습중인데 소나ㄱㅊ?","zicbakguri "," ","06.08"
"페이커 군대갈때쯤이면 롤판 이미 망했을걸","ㅇㅇ ","106.245 ","06.08"
"LCK 마지막 희망은 킹존 그리핀","ㅇㅇ ","198.16 ","06.08"
"LPL 지역리그 제대로 돌아가냐?","ㅁㅁ ","119.69 ","06.08"
"제발 탈론패시브좀 바꿔라 ㅅㅂ","ㅇㅇ ","39.121 ","06.08"
"g2 유쾌하다고 하는 놈들 특징","123 ","221.150 ","06.08"
"RNG 3연승이네? 서머우승각이냐?","ㅅㅅ ","110.15 ","06.08"
"롤 아이디 7개됐다","&gt;<U+2662>&lt; "," ","06.08"
"아이돌에 돈쓰는 거 돈낭비맞냐?","ㅇㅇ ","114.206 ","06.08"
"방금 상대 텔강타 미드누누 나와서 이겼다","ㅇㅇ ","61.102 ","06.08"
"얘두랑 로그인 내역 본인인증 해야 볼수잇어??","예루루 "," ","06.08"
"저티어 나서스하는애들 진짜 개못함","ㅇㅇ ","39.112 ","06.08"
"갱맘은 미드서 바루스 잡고 TCL경기하고 있네","ㅇㅇ ","211.179 ","06.08"
"슼갈들은 언제 정신차릴까 ㅋㅋ 진에어한테 2대떡난거면 걍 강등권아님?","ㅇㅇ ","121.137 ","06.08"
"지금 사설방에 AI 추가 안 되는 거지??","딩기 ","27.35 ","06.08"
"나서스 처음 해보려는데요","ㅇㅇ ","180.228 ","06.08"
"페이커 군대가면 SKT 망할 듯","ㅇㅇ "," ","06.08"
"강타말자하 파란강타드냐?","ㅇㅇ ","211.36 ","06.08"
"어디 티어 같나요?",".. ","183.109 ","06.08"
"스맵도 한 때 탑 패왕소리들었는데","ㅇㅇ ","218.48 ","06.08"
"니들은 전부 전기회로고 내가 주인공인거 알고있냐?","ㅇㅇ ","58.227 ","06.08"
"맞네 내일 skt 장례식이네","ㅇㅇ ","61.82 ","06.08"
"g2 msi한번 쳐먹었다고 꼴깝떠는게","ㅇㅇ ","39.117 ","06.08"
"다4 13포주고 16포깎는데 존나 지옥같다","ㅇㅇ ","218.55 ","06.08"
"씨발 칼바람 유미 존나 짜증나네","ㅇㅇ ","118.44 ","06.08"
"스멥은 17년에 롤드컵 나가서 우승했어야함","ㅇㄴㅇ ","59.6 ","06.08"
"피오라 심각한데 한사람이 누구임","ㅇㅇ ","211.117 ","06.08"
"ㅈㄹ말고 내일 개좆슼 2대떡먹고 울지나마라 ㅋㅋ","ㅇㅇ ","121.137 ","06.08"
"실버자유랭 1자리비는데 올사람","ㅇㅇ ","175.223 ","06.08"
"튜토버그 언제고칠거야 씨발","사라사 "," ","06.08"
"19썸머 = 16썸머","ㅇㅇ "," ","06.08"
"지금롤이 옛날롤보다 훨씬재밌는데","ㅁㅁ ","223.38 ","06.08"
"플래에서 겜하면서 플래도 애미뒤진것같아서 맨날욕하면서 했는데","ㅇㅇ ","116.34 ","06.08"
"말자하 존내 날먹챔이네","ㅇㅇ ","121.169 ","06.08"
"skt 딱 작년 킹존꼴 난거 같은데 ","ㅇㅇ ","175.120 ","06.08"
"데프트 내년엔 슼 들어가서 롤드컵 먹어야지","ㅇㅇ ","223.62 ","06.08"
"원더는 생긴게 왜케 메이즈러너에나오는애같냐","ㅇㅇ ","121.175 ","06.08"
"스맵이고나발이고 kt 그냥 솔랭5명 급조한거같다","ㅇㅇ ","61.82 ","06.08"
"Lck자위랑 보는 원리가 비슷한거같음","ㅇㅇ ","58.227 ","06.08"
"ㄹㅇ 부랄쪽 존나 땡겨서 아픈데 비뇨기과가면 정상이래","ㅇㅇ ","218.147 ","06.08"
"왜 념글에 피오라 심각한데? 없누","ㅇㅇ ","218.233 ","06.08"
"실버구간 서폿구함ㅇㅇ","ㅇㅇ ","222.234 ","06.08"
"야 얘들아 요즘 짱깨새기들이 우리 아이디 해킹하는거가틈 ㅠㅠㅠ","예루루 "," ","06.08"
"즙라디 연습 작년엔 존나 했는데 요즘 안하는건","ㅇㅇ ","39.122 ","06.08"
"피저시비르 스킨주면 평생 슼팬가능?","ㅇㅇ ","112.148 ","06.08"
"지금 카밀라인전 되게쌘거같음","Jaazzyfact "," ","06.08"
"앞갈들 진에어 전패 막은게 아프리카였던건 벌써 까먹었노 ㅋㅋ","ㅇㅇ ","121.167 ","06.08"
"닷지로 mmr만 높여두면 다음 시즌할 때는 그 mmr 대로 배치받냐?","ㅁㄴㅇㄹ ","211.224 ","06.08"
"Lpl에서는 타잔이랑 클리드 누굴 높게 쳐주냐?","ㅇㅇ ","58.227 ","06.08"
"ㅅㅅ 토쟁이들을 위해) 낼 킹존 2대0 승 앞 2대 1 가면 된다","ㅇㅇ ","198.16 ","06.08"
"캡스 tl전보고 쌋음 미드가 다 터리고다님","ㅇㅇ ","58.77 ","06.08"
"엠비션 진에어가면 플옵은갈꺼같은데","ㅇㅇ ","211.36 ","06.08"
"뇌절 없는 데프트면 세체원 가능하다고 봄?","123 ","221.150 ","06.08"
"피시방대회 순회하는 샛기들도있나?","ㅇㅇ ","112.148 ","06.08"
"팩트를 말해도 페드립하네 슼갈답게 ㅠ 섬머에 가장 약한거 맞자너 느그슼","ㅇㅇ ","198.16 ","06.08"
"lec는 해설도 뭔 컴터 통계로 하더라","ㅇㅇ ","223.62 ","06.08"
"슼갈새끼들아 유칼기인에이밍 어떻게 이길건데? ㅋㅋ","ㅇㅇ ","121.137 ","06.08"
"데프트는 내년이 마지막 기회임 ㅇㅇ","ㅇㅇ "," ","06.08"
"고소한다고해서 쫄리면","ㅇㅇ ","223.62 ","06.08"
"스카너 챔프 질문좀","ㅇㅇ ","220.93 ","06.08"
"진지하게 시비르 w 치명타 삭제해야댐","ㅇㅇ ","218.237 ","06.08"
"왜 역대 최전선기기준에 마린이들어가냐?","ㅇㅇㅇ ","211.179 ","06.08"
"징크스 bf 다음에 루난가는거 별로??","ㅇㅇ ","61.254 ","06.08"
"걍 요즘 미드 빡캐리는 잘 안되는거같다","ㅇㄷㅇㅈㅇ "," ","06.08"
"지금 관계자 기대도르 받은게 젠지임 아프리카임??","ㅇㅇ ","117.111 ","06.08"
"닉넴 오리아나 주유구 ㅁㅌㅊ?","ㅇㅇ ","175.223 ","06.08"
"3년만에 롤 복귀하는데","ㅇㅇ ","119.194 ","06.08"
"나 슼갈인데 캡스가 그렇게 잘하는지 몰랐다","ㅇㅇ ","58.77 ","06.08"
"도파 프로데뷔하면 하위권일거라하는데","ㅇㅇ ","223.33 ","06.08"
"근데 ㄹㅇ skt g2 4강 재밌었는데","ㅇㅇ ","121.167 ","06.08"
"투신도 시즌별 로또 스타일인듯","123 ","221.150 ","06.08"
"노틸 너프해 시발","헴펠 "," ","06.08"
"겜 상에서 욕하는게 고소가됨?","오늘부터_우리는 "," ","06.08"
"롤알못들 아는 척좀 하지마라 슼이 뭔 재주로 결승을 간다고 ㅋㅋ","ㅇㅇ ","198.16 ","06.08"
"2019 LCK서머 순위.txt","175.126 ","175.126 ","06.08"
"데프트는 무조건 올해 롤드컵은 우승해야함","ㅇㅇ ","112.149 ","06.08"
"진짜 클템 김동준 해설 개같음","ㅇㅇ ","223.62 ","06.08"
"진에어전 그레이스 린다랑 루트한테 개발리는거 봐놓고 아프리카 이긴다는","ㅇㅇ ","121.137 ","06.08"
"KT는 서폿서브를 데려왔어야","ㅇㅇ ","221.146 ","06.08"
"쵸비 ㅂㅅ이냐? 리산 궁플하면 반응못하는데","ㅇㅇ ","27.113 ","06.08"
"칼바람 5:5 재밌게 하자 사용자 설정게임 ㄱㄱㄱ","ㅇㅇ ","39.115 ","06.08"
"슼갈새끼들 슼갈아닌척하면서 슼이 결승갈것같다 ㅇㅈㄹ ㅋㅋ","ㅇㅇ ","121.137 ","06.08"
"걍 눈꽃은 지금 투신이랑 worst 자강두천임","ㅇㅇ ","223.39 ","06.08"
"응원하는 팀 없고 SKT가 지는 경기만 재밌음","ㅇㅇ "," ","06.08"
"야 근데 왜 고소는 패드립만 하냐","ㅇㅇ ","210.178 ","06.08"
"노틸 너프 언제하냐 씨발새끼","헴펠 "," ","06.08"
"skt 개좆같긴 한데 이번 써머도 결승은 갈거같음","ㅇㅇ ","223.62 ","06.08"
"15마린 사이한테밀렸냐","mystelee "," ","06.08"
"교수님 1세트에서 르블랑한테 짤린거 교수님이 방심한게 큰거냐","ㅇㅇ ","121.184 ","06.08"
"역대 라인별 최전성기 최고는 누구라고 생각함?","123 ","221.150 ","06.08"
"내일 샌드박스 좆될준비해라 대황존 나가신다 씹새기들아","ㅇㅇ ","112.149 ","06.08"
"롤갤 평균티어 뭐냐 시발것들아","ㅇㅇ ","211.36 ","06.08"
"15에 마린&gt;스멥&gt;상면&gt;마린 구도 아니엿냐","ㅇㅇ ","112.162 ","06.08"
"쵸비는 멘탈을 키워야","ㅇㅇ ","221.146 ","06.08"
"솔직히 내일 안봐도 킹존 2대0 슼 2대0일거 같은데","ㅇㅇ ","223.39 ","06.08"
"내일 갤 터지는 방법","ㅇㅅ ","221.151 ","06.08"
"내일한체팀 킹존 무난하게 승  아프리카는 진에어동급개좆슼 졷바르고 1승","ㅇㅇ ","121.137 ","06.08"
"리라 시작하는날 예비군간다 죽고싶다","ㅇㅇ ","116.122 ","06.08"
"퐁부 ㅈㄴ그립다 ㄹ","ㅇㅇ ","221.146 ","06.08"
"근데 슼도 msi 후반부엔 좀 빨라지지 않았음?","ㅇㅇ ","39.7 ","06.08"
"피넛 리신 왜하는지 몰겟음 ㄹㅇ..","ㅇㅇ ","125.184 ","06.08"
"내일 KZ, AFs 승리 예상","oo ","218.149 ","06.08"
"바이퍼식으로 이즈템가면 뭐가 좋음?","ㅇㅇ ","112.162 ","06.08"
"그래서 타잔이랑 클리드랑 누가 더 잘하냐?","ㅇㅇ ","58.227 ","06.08"
"skt의 e스포츠 공헌","ㅇㅇ ","223.62 ","06.08"
"급식혼밥 꿀팁 알려드림","ㅇㅇ ","211.36 ","06.08"
"르블랑으로 말자하 솔킬따기 존나 힘든대?","ㅇㅇ ","61.72 ","06.08"
"슼갈때문에 슼 욕하는 이유","ㅇㅇ ","198.16 ","06.08"
"슼갈 때문에 슼 욕한다는 사람 보셈","ㅇㅇ ","223.38 ","06.08"
"베인 고연포는 구리냐","ㅇㅇ ","121.164 ","06.08"
"머야 오늘 괴물쥐유튜브영상 왜안올라옴?","Hora1 "," ","06.08"
"Skt","ㅇㅇ ","39.114 ","06.08"
"g2새끼들 좀 추한건 팩트 아니냐","123 ","221.150 ","06.08"
"슼 내일 진짜 한세트 지면","ㅇㅇ ","221.141 ","06.08"
"닷지질해서 mmr작 한 효과가 나오기 시작한거 같다.","ㅁㄴㅇㄹ ","211.224 ","06.08"
"슼 진에어전은 솔까 만만하게 본게 맞음","ㅇㅅ ","221.151 ","06.08"
"여고딩 한테 번따당해서 사귐","ㅇㅇ ","106.102 ","06.08"
"팀운땜에 못올라가겠다 씨발 진짜","ㅇㅇ ","14.51 ","06.08"
"탑베인 라이즈 베인이 이기는게 정상아니야?","ㅇㅇ ","211.36 ","06.08"
"다딱까지 듀오해달라는 친구","ㅇㅇ ","223.62 ","06.08"
"베인 궁쓰고 구르기할때 거리 늘어나면 사기겠지?","ㅇㅅㅇ ","123.214 ","06.08"
"롤에는 레어닉먹는 매크로 없지","ㅇㅇ ","112.151 ","06.08"
"유튜브 구독 눌러주실 착한분 (강요X)","ㅇㅇ ","121.128 ","06.08"
"럭스 이시발년 보호막너프시켜야됨","ㅇㅋ ","116.127 ","06.08"
"내일 슼 아프리카한테 지면 갤 터지냐 ????","ㅇㅇ ","118.221 ","06.08"
"점화들고 텔한테 솔킬따이는 애미뒤진 렝가 오체분시시키고싶다 ㄹㅇ","ㅇㅇ ","61.102 ","06.08"
"Lec 프차화 된게 언제부터임?","ㅇㅇ ","39.7 ","06.08"
"다2랑 플1 듀오됨?","ㅇㅇ ","1.241 ","06.08"
"키아나 나오면 필벤이냐","poiu "," ","06.08"
"칸은 이름 별명없냐???","ㅇㅇ ","118.37 ","06.08"
"이번에 인터뷰 또 실수함?","ㅇㅇ ","220.126 ","06.08"
"친구가 다딱까지 듀오해달라는데","ㅇㅇ ","223.62 ","06.08"
"새벽 3시에 쪼맹이들 축구 응원할라는대","카타기리에리카 "," ","06.08"
"롤붕이 교수님 경기 복습해봤는데 ","ㅇㅇ ","203.226 ","06.08"
"여고딩 따먹은거 자랑하고싶다","ㅇㅇ ","106.102 ","06.08"
"팀갤 순회하는데","ㅇㅇ ","223.33 ","06.08"
"지금 비디디보다 못하는 주전미드는 내현,그레이스 끝","ㅇㅇ ","223.39 ","06.08"
"진짜 개애미뒤진 팀운이다 ㄹㅇ","ㅇㅇ ","61.102 ","06.08"
"니엘킨그 시절 잘하는정글들은 상대 정글 찾아다니면서","ㅇㅇ ","125.184 ","06.08"
"성인되서 여고딩 따먹어본사람 솔직히 손","ㅇㅇ ","106.102 ","06.08"
"SKT 내일은 1군 총출동할거다","ㅇㅅ ","221.151 ","06.08"
"스물 네 살인데 ","Artxe "," ","06.08"
"마이정글이 안좋음??","ㅇㅇ ","223.62 ","06.08"
"솔직히 우리팀이 9등해도 슼이 꼴찌하면 좋겠다","ㅇㅇ ","220.70 ","06.08"
"블라 디 지게몬테vs씨에 쑤왕","ㅇㅇ ","39.7 ","06.08"
"롤알못인데 자주 싸우는 게임 관전이 더 재밌는것같음","ㅇㅇ ","58.143 ","06.08"
"D점화쓸때 스마트키 필수냐","ㅇㅇ ","211.47 ","06.08"
"여중딩 vs 여고딩","ㅇㅇ ","106.102 ","06.08"
"다딱서포터랑 실골듀오 양학할 플~다딱이","ㅇㅇ ","218.50 ","06.08"
"페이커음해하려는 세력들 ㄷㄷ 폼 떨어진 7년차 프로선수가","ㅇㅇ ","223.62 ","06.08"
"유미진짜애미뒤졌네 씨발 ","ㅇㅇ ","223.62 ","06.08"
