"dc_title","dc_writer","writer_ip","dc_date"
"첫경험누나가 내가 해본여자중에 탑3안에 들어서","카라빱 ","14.37 ","05.27"
"아직도 음키타리안 거리는 애들은 2012~13년에서 왔냐?","ME9 "," ","05.27"
"후전드 이 씹은 왜 계속 뽑냐 축협픽이냐?","ㅇㅇ ","1.211 ","05.27"
"나는 중3때 특성화고 간판누나한테 따먹힘","카라빱 ","14.37 ","05.27"
"니애미 인자기","ㅇㅇ ","223.33 ","05.27"
"고딩때 개꼴림 떡밥 왜 사라졌냐","ㅇㅇ ","211.46 ","05.27"
"성씨류 이름력 원탑은 이거지","ㅇㅇ ","223.38 ","05.27"
"남들처럼 중딩때 아다 못떼고 고3때 뗀게 조금 창피","ㅇㅇ ","175.194 ","05.27"
"탁씨 육씨는 나름 괜찮은데","카라빱 ","14.37 ","05.27"
"솔까 난 인싸인거 별로 안좋아하는데 ","ㅇㅇ ","121.162 ","05.27"
"세미나인 vs 노무연 누가 더 해임드?","ㅇㅇ ","223.62 ","05.27"
"보닌이 확실히 아싸 성향인가 봄","MeNaldo ","119.205 ","05.27"
"나씨도 이름 잘못지으면 ㅈㄴ 추함","ME9 "," ","05.27"
"병권이름에 방씨붙인다고 생각해봐 ㄷㄷ","카라빱 ","14.37 ","05.27"
"오토바이 부르릉소리 큰새끼들 발로쳐까고싶지않냐","카라빱 ","14.37 ","05.27"
"여자애들 프사 보정개떡칠사긴데 이쁘다고울어대는거","ㅇㅇ ","124.50 ","05.27"
"솔직히","ㅇㅇ ","223.33 ","05.27"
"거꾸로해도 똑같은 이름","ㅇㅇ ","223.33 ","05.27"
"어떤 이쁜 이름으로도 구제안되는게 '방씨'임","카라빱 ","14.37 ","05.27"
"노무현 이름이 노두현이었으면 아직 살아있었따","ㅇㅇ ","211.46 ","05.27"
"내가 아는 두람이란 여자애 존예인데","카라빱 ","14.37 ","05.27"
"닉네임에 다,현 들어 있는새끼 특)","ㅇㅇ ","1.244 ","05.27"
"내가 아름이란 이름의 여자친구를 사귄적이있는데","ㅇㅇ ","223.39 ","05.27"
"이름 가운데자가 '두'인 새끼들은 100프로 확률로 찐따 아님","ㅇㅇ ","211.46 ","05.27"
"본인 대학 생활 특)","MeNaldo ","119.205 ","05.27"
"아싸 프사가 무슨 술자리 고추밭 셀카야","ㅇㅇ ","211.46 ","05.27"
"내 동명이인 티비에서 본거 딱 한번 있는데","ㅇㅇ ","211.46 ","05.27"
"맹구 씨벌럼들은 9위가 적당한듯","ㅇㅇ ","121.171 ","05.27"
"진짜 중고딩시절 부터 대딩 지금까지 쭉 존잘로 살아서","ㅇㅇ ","121.162 ","05.27"
"쿠보 j리그 벤치딱 할떄 이강인은 국왕컵 커리어 추가하네","만루값 "," ","05.27"
"남자새끼들한텐 발린말이든 뭐든 잘생겼단말 꽤 들어봣는데","ㅇㅇ ","223.33 ","05.27"
"프사로 그냥 아빠 얼굴 올려놔라","ㅇㅇ ","211.46 ","05.27"
"나 존잘인데 씹덕 프사 해봤다 ㅇㅇ.result","ㅇㅇ ","121.162 ","05.27"
"중성적인 이름 뭐 있냐","ME9 "," ","05.27"
"버디버디충새끼들 특:","ㅇㅇ ","223.39 ","05.27"
"전 제 귀두 ㅡㅡ","하라구구 "," ","05.27"
"서강준이 럽라프사하면 여자들 럽폭도로 변모 ㅇㅇ","카라빱 ","14.37 ","05.27"
"진짜 존잘새끼가 씹덕프사로 1주일 사는 컨텐츠 이런거 했으면","ㅇㅇ ","110.47 ","05.27"
"정 프사 할거없다 그럼 이거하면됨","ㅇㅇㅇㅇㅇ ","211.196 ","05.27"
"가끔  존못들이 보정 존나 해서 얼굴프사 하면","ㅇㅇ ","121.162 ","05.27"
"지금 같이 오버워치 그마 올라가실분 구함","재미없는애 "," ","05.27"
"내 카톡 배경사진 아직도 새해복 많이 받으세요임","ㅇㅇ ","211.46 ","05.27"
"경험상 준호라는 이름 이름만 들어도 못생김","ㅇㅇ ","124.50 ","05.27"
"와꾸 서강준이면 러브라이브로 프사해도 톡이렇게옴","카라빱 ","14.37 ","05.27"
"사실 프사는 애니프사 아이돌프사만 아니면 뭘로 해놔도 신경 잘 안쓴다.","ㅇㅇ ","211.46 ","05.27"
"존잘이어도 일베면 까이지","ㅇㅇ ","223.39 ","05.27"
"카톡프사 오버워치 현점수ㅇㅇ","재미없는애 "," ","05.27"
"사진안찍는 찐따들 하기좋은 프사이거임 앨범배경프사","ㅇㅇㅇㅇㅇ ","211.196 ","05.27"
"이름부터 존나 못생겨보이고 그런거 있지 않냐?","ㅇㅇ ","110.47 ","05.27"
"엘지 5G 골프 컨텐츠도 재밌겠네","ㅇㅇ ","117.111 ","05.27"
"근데 사실 나는 내가 존잘이라서 ㅇㅇ","ㅇㅇ ","121.162 ","05.27"
"오피셜)프사 완벽하게 결론내줌 병신들아.txt","카라빱 ","14.37 ","05.27"
"내 주변 아이돌 말고 배우상인 씹존잘 새끼 프사","ㅇㅇ ","112.214 ","05.27"
"축구 하는거 동영상으로 찍어두고","ㅇㅇ ","211.46 ","05.27"
"프로필 음악 어줍잖게 클래식 올려놓는 병신들","ㅇㅇ ","223.33 ","05.27"
"축잘알 프사 특...","bv ","221.140 ","05.27"
"정보))리그별 유로예선,유에파네이션스리그 소집명단 이피엘선수가 익숙한이유","ㅇㅇ ","1.229 ","05.27"
"진짜 20중후반인새끼들 학창시절에 잘나가는척하려고","ㅇㅇ ","223.39 ","05.27"
"내 프사궁금해?","카라빱 ","14.37 ","05.27"
"아니면 취미활동 하고있는거 프사로 하든가","ㅇㅇ ","211.46 ","05.27"
"그냥 카페가서 찍어 달라고 해","ㅇㅇ ","211.46 ","05.27"
"못생긴 새끼는 프사 없음으로 하는게 가장 맞지 않냐?","ㅇㅇ ","110.47 ","05.27"
"국왕컵 우숭후 '드레싱룸서 이강인 응원가'","ㅇㅇㅇ ","112.148 ","05.27"
"존잘은 프사 배사 비워놔도 됨 ㅇㅇ","ㅇㅇ ","121.162 ","05.27"
"원래 여자애랑 포옹하고하면 발기하는건데","카라빱 ","14.37 ","05.27"
"이씨발 여기 인싸밖에없냐? 버디버디 문친해본놈이 없다고?","ㅇㅇ ","223.39 ","05.27"
"젖닌패게 추천좀 ㄱㄱㄱㄱㄱㄱㄱㄱㄱㄱㄱㄱㄱㄱㄱㄱㄱ","ㅇㅇ ","182.215 ","05.27"
"무난한 프사할려면 그냥 좋아하는 음식사진 넣어라","ㅇㅇ ","61.41 ","05.27"
"본인 학창시절에 잘나가는 일진 여자애 한 5명정도 사겼었음 ㅋㅋ","ㅇㅇ ","110.47 ","05.27"
"고양이 프사건 호날두 프사건 잘생기면 됨ㅇㅇ","ㅇㅇ ","121.162 ","05.27"
"근데 지금와서보면 개좆두가 맹구가는것도 ㄱㅊ은거같음","ㅇㅇ ","182.222 ","05.27"
"솔직히 이거 20중반인새끼들은 공감할듯","ㅇㅇ ","223.39 ","05.27"
"내가 개 씨발 병신 모쏠아싸찐따인거 자각한 순간","ㅇㅇ ","110.47 ","05.27"
"40년 후 정채연이랑 사귀기vs40년전 ㄹ혜랑 동거하기","ME9 "," ","05.27"
"성인이면 메졷두 사진보다 더 심각한새끼들은","ㅇㅇ ","221.145 ","05.27"
"유딩때 개꼴렷던거","ㅇㅇ ","223.39 ","05.27"
"정보))리그별 유로예선 소집명단 느그라리가수준","ㅇㅇ ","1.229 ","05.27"
"근데 성인인데도 핸드폰 배경화면 좆두면 개병신이냐?","ㅇㅇ ","110.47 ","05.27"
"이성과 관련해서 덕질하는새끼들은 진짜 패배자들임ㅋㅋ","흥짱남 ","221.148 ","05.27"
"보첼리 챔스 이거 얘기하는거냐","ㅇㅇ ","223.33 ","05.27"
"고백)중3때 노록바가 바탕화면이었음","ME9 "," ","05.27"
"ㄹㅇ 챔스는 안드레아보첼리지 ㅇㅇ","ㅇㅇ ","223.62 ","05.27"
"요즘에 단발 고딩이 왤케 좋냐","MeNaldo ","119.205 ","05.27"
"성인되면 급식때랑 완전 달라지지 ㅋㅋ ","ㅇㅇ ","223.33 ","05.27"
"초딩때 개꼴렷던거","ㅇㅇ ","223.39 ","05.27"
"챔스는 틀딱 안드레아보첼리가 간지 나게 쫙쫙 불러줘야","ㅇㅇ ","121.162 ","05.27"
"담배피는년이랑 키스하면 개좆같은데","흥짱남 ","221.148 ","05.27"
"2019년 대한축구협회장배 전국고교축구대회 응원단 명단","ㅇㅇ ","210.90 ","05.27"
"손벤딱","111 ","1.234 ","05.27"
"비니를 빠네","ㅇㅇ ","223.33 ","05.27"
"메시 코파 또 떨어질 생각하니","ㅇㅇ ","175.223 ","05.27"
"대학친구 vs 급식친구","ㅇㅇ4 ","180.71 ","05.27"
"담배피는 여자들 나만꼴리냐?","ㅇㅇ ","110.47 ","05.27"
"성악설 인생 넘나 불쌍해ㅜㅜㅜㅜ","카라빱 ","14.37 ","05.27"
"진짜 초등학교는 남녀 공동이고 중고등학교 남녀공학갓는데","ㅇㅇ ","223.39 ","05.27"
"이번 챔스 오프닝 누가 부름???","ㅇㅇ ","121.162 ","05.27"
"근데 인싸들은 다 호날두 빰 ㄹㅇㅍㅌ ㅋㅋㅋㅋㅋㅋ","ㅇㅇ ","110.47 ","05.27"
"여기가 야갤이냐 호성시 샤샤샤시 같은것도 따라하네","ME9 "," ","05.27"
"초딩때 옆반 선생 젖탱이 존나 컷음","ㅇㅇ ","180.66 ","05.27"
"이상성욕 떡밥 타임이냐","ㅇㅇ ","223.33 ","05.27"
"저 낮잠좀 자겟음 ㅡㅡ","하라구구 "," ","05.27"
"메좆이 리더로서의 자질이 없는건 팩트 아니냐","ㅇㅇ ","110.47 ","05.27"
"시급 5만원 이하 직업으로 안쳐줌","하라구구 "," ","05.27"
"리버풀 바르샤 2차전 4번째 골 다시봐도 존나 웃기네ㅋㅋㅋ","ㅇㅇ ","59.27 ","05.27"
"초딩찐특)닿는 물건마다 썩는 저주받은 손을 가졌음","ME9 "," ","05.27"
"대충 그까이거 이거 말씀하시나","하라구구 "," ","05.27"
"얘들아 이러는시간에 나는 시급이 3만원이야..","카라빱 ","14.37 ","05.27"
"초딩때는 다공유하지않나?","ㅇㅇ ","223.39 ","05.27"
"본인 중학교 때 여초선생 학교 다녔다가 고딩 때 씹남초선생 학교다님","ME9 "," ","05.27"
"대충 ~~~하는 댓글 이거 어디서 시작한 유행어임","하라구구 "," ","05.27"
"이러는 시간에 홈쇼핑이라도 굴려봐 친구들..","카라빱 ","14.37 ","05.27"
"충격적이겠지만 이승우는 아스날가면 손흥민 넘을수 있음","ㅇㅇ ","104.248 ","05.27"
"27세 악설이 고민 수준보소 ㅋㅋㅋ","하라구구 "," ","05.27"
"데파이 맨유복귀","홍학이 "," ","05.27"
"맹구들 그리즈만 영입 설레발 치던데","ㅇㅇ ","110.70 ","05.27"
"진짜 초딩때는 집에 여자애들불러와서","ㅇㅇ ","223.39 ","05.27"
"어제 베로나 경기보고 느낀점","ㅁㅈㅈ ","218.236 ","05.27"
"근데 왜 메시가 구토냐?","ㅇㅇ ","1.228 ","05.27"
"고딩때 개꼴렷던거 2","ㅇㅇ ","223.39 ","05.27"
"갠적으로 우리나라유망주는 오래봐야생각함","ㅇㅇ ","125.177 ","05.27"
"가정시간에 여자애가만들어준 샌드위치 개꿀맛","1233 ","223.62 ","05.27"
"바르샤 이번 시즌 ㅈ망인데","ㅇㅇ ","14.34 ","05.27"
"니들도 ㅈㄴ 장난치다가 실수로 슴가 터치한적 있지않냐?","ㅇㅇ ","211.46 ","05.27"
"교실에서 배드민턴치다 형광등 운지시킴ㅋㄱ","1233 ","223.62 ","05.27"
"고딩때 걸레 한명 지금 유명 유튜버던데","ㅇㅇ ","211.46 ","05.27"
"초딩때 개꼴렷던거2","ㅇㅇ ","223.39 ","05.27"
"틀딱인데 요즘애들 ㄹㅇ넷상관계에 익숙하드라","틀따닥 ","223.62 ","05.27"
"초딩때 개꼴렷던거","ㅇㅇ ","223.39 ","05.27"
"급식때는 다들 눈깔이 이상했었지 지금 졸업앨범보면 여선생들 다 한녀1임","ㅇㅇ ","59.3 ","05.27"
"중딩때 개꼴렷던거","ㅇㅇ ","223.39 ","05.27"
"중딩때 개꼴렸던거","ㅇㅇ ","211.46 ","05.27"
"고딩때 씹꼴리는거","ㅇㅇ ","223.39 ","05.27"
"고딩때 개꼴렷던거","ㅇㅇ ","223.39 ","05.27"
"문학쌤 이쁜건 만국공통이냐","ㅇㅇ ","211.46 ","05.27"
"돈 많으면 ucla vs 연세대 어디가냐?","ㅇㅇ ","107.77 ","05.27"
"긱사에서 폰만지고자는게대학생활의꽃인듯","ㅇㅇ4 ","180.71 ","05.27"
"난긱사살면서 룸메안들어오늕날이제일좋더라","ㅇㅇ4 ","180.71 ","05.27"
"발 사이즈 큰 놈이 발롱받아야지","ㅇㅇ ","211.36 ","05.27"
"유대님 님이 아는 정보 사실 다 틀림","하라구구 "," ","05.27"
"(BBC) 맨시티 회장&quot;거 참 새끼들 질투 쩌네&quot;","ㅇㅇ ","124.53 ","05.27"
"왜 비오는 날만 되면 배달음식이 먹고 싶지 ㄹㅇ 과학인가","Lionel "," ","05.27"
"성악설 첫 념글행임? ","ㅇㅇ ","211.36 ","05.27"
"고딩때 개꼴렸던거","ㅇㅇ ","211.46 ","05.27"
"아 뭔가 루카스가 선발 아닐꺼 같어","ㅇㅇ ","116.121 ","05.27"
"아랍 정우영은 이제 안뽑냐?","김치참치맨 "," ","05.27"
"메좆 발롱 끝났는데 날두가 전반기 잘하면 가능성있냐?","ㅇㅇ ","175.194 ","05.27"
"버기까는 애들 대부분은 재미로 까는데 ㅋㅋ","ㅇㅇ ","211.46 ","05.27"
"보통긱사살면 대학교에서 이시간에머하냐","ㅇㅇ4 ","180.71 ","05.27"
"고딩 순수했던시절 젤 꼴렸던거.txt","ㅇㅇ ","175.194 ","05.27"
"버기단이 좆비호감인이유는 얘네 80프로가 일뽕임 ㅇ","ㅇㅇ ","59.3 ","05.27"
"하라구구 + 해외축구갤러리 = 성악설 정답이냐?","카라빱 ","117.111 ","05.27"
"지금 해충갤이 역대급 꿀잼인 이유","ㅇㅇ ","223.33 ","05.27"
"대학교왜케노잼ㅈ이냐","ㅇㅇ4 ","180.71 ","05.27"
"ㄹㅇ 손박대전 끝난지 오랜데 그냥 버기 까는게 재밌어서 버기 까는중","ㅇㅇ ","211.46 ","05.27"
"대학기숙사에서 폰만지는게개꿀아님?","ㅇㅇ4 ","180.71 ","05.27"
"메좆은 왜 까이는거냐??","ㅇㅇ ","106.102 ","05.27"
"하라구구가 디시를 안했더라면....","카라빱 ","117.111 ","05.27"
"좆악설 틀딱린하고 동갑인데","ㅇㅇ ","223.39 ","05.27"
"박지성은 호날두 루니 긱스 다 올려쓰니 빈틈메꾸려고 선발쓴거지","ㅇㅇ ","221.156 ","05.27"
"피시방까지 우산 들어주실분 구함","재미없는애 "," ","05.27"
"근데 다들 똥싸는김에 딸치지않냐?","ㅇㅇ ","175.194 ","05.27"
"축INTL 터키 VS 그리스","ㅇㅇ ","1.230 ","05.27"
"오 뮌우영 3부리그 올라갔네","ㅇㅇ ","124.54 ","05.27"
"리그 38경기중 39실점이면 잘한거임??","개병신임 "," ","05.27"
"유대가 뭐지","하라구구 "," ","05.27"
"프로 딸쟁이들은 이제 옷벗은거 보면 더이상 안꼴림","ㅇㅇ ","211.46 ","05.27"
"지빠 알정도면 저새끼도 10년이상 한 새낀데","하라구구 "," ","05.27"
"클롭정도면 명장이냐?","ㅇㅇ ","223.38 ","05.27"
"서울대 꼴찌 vs 지잡대 1등 누구승?","ㅇㅇ ","211.46 ","05.27"
"근데 진심 바르셀로나 좆병신 아니냐?","ㅇㅇ ","61.76 ","05.27"
"박지성은 ~~로치면 ~지 이거 누가 먼저 시작했냐ㅋㅋㅋㅋ","ㅇㅇ ","220.92 ","05.27"
"근데요 성악설님 님은 좆뉴비새끼인데요 ㅇㅇ","카라빱 ","117.111 ","05.27"
"저 그래도 나름 전문직 ㅡㅡ","하라구구 "," ","05.27"
"디시 ㄹㅇ 찐따들이 하면 안된다.","ㅇㅇ ","211.46 ","05.27"
"손박대전은 이미 손흥민 승리로 종결났는데 손뽕들만 남아서 쉐복중","ㅇㅇ ","211.46 ","05.27"
"옛날이 돌아이가 글쓰면 댓글 5개 이상씩 달림 ㅡㅡ","하라구구 "," ","05.27"
"나 직업있는데 병신아","하라구구 "," ","05.27"
"해충전성기 09~13봄 ㅇㅇ","하라구구 "," ","05.27"
"본인 걍 첨부터 해충갤로 디씨 입문함","하라구구 "," ","05.27"
"제가 여기서 젤 형인데 존댓말 부탁함","하라구구 "," ","05.27"
"손박대전이 끝나는 경우가 2 가지맞지??","ㅇㅇㅇㅇㅇ ","211.196 ","05.27"
"외국에서 제일 먹히는 동양인 남성 얼굴","ㅇㅇ ","211.46 ","05.27"
"디씨하면 안 순수한건가 ㅡㅡ","하라구구 "," ","05.27"
"모든 것이 노무현이 하는 것만 반대하면 다 정의라는 거 아니겠습니까!","ㅇㅇ ","203.237 ","05.27"
"이정협은뭐냐","ㅇㅇ ","175.223 ","05.27"
"호삽이 저 냄져새끼 워딩 하나하나가 역겹네","하라구구 "," ","05.27"
"28살인데 소혜랑 결혼하는 상상해도 되는지","하라구구 "," ","05.27"
"한국남자들은 더치페이스 안됨 ㄹㅇ 커플들도 와꾸차이 심함","ㅇㅇㅇ ","117.111 ","05.27"
"한남특))예쁜 한녀보니까 주제를 모름.","ㅇㅇㅇ ","117.111 ","05.27"
"한국년도 못따먹는 우리가 서양녀를 논하는 이유","ㅇㅇ ","211.46 ","05.27"
"예쁜한국여자는 많은데 리얼 잘생긴 남자는 본 적이 없음,,","ㅇㅇㅇ ","117.111 ","05.27"
"아니 보다못해 글쓰는데 동유럽이던 서유럽이던 안만나준다니까 ㅋㅋㅋㅋ","ㅇㅇㅇ ","117.111 ","05.27"
"손뽕들아 아시아 축구선수 역대 no.1 손흥민임????","ㅇㅇ ","211.46 ","05.27"
"솔직히 손뽕인데 한국원탑은 박지성이맞다","ㅇㅇ ","223.39 ","05.27"
"레전드매치 뮌헨이랑 자주 하는 이유가 뭐임?","ㅇㅇ ","121.134 ","05.27"
"유럽에 여자꼬시러갈거면 동유럽이 답임","ㅇㅇ ","39.7 ","05.27"
"이번챔스결승 이렇게 늦게하는 이유가 있음??","ㅇㅇ ","106.240 ","05.27"
"그리즈만 황유 갈듯","ㅇㅇ ","223.38 ","05.27"
"야 주형아 ㅡㅡ","하라구구 "," ","05.27"
"해축갤에 한남 천지네; 글 수준 너무 떨어진다.","ㅇㅇ ","117.111 ","05.27"
"소혜 미드 보구가","ㅇㅇ ","211.46 ","05.27"
"궁금해서 그러는데 비셀고베가 왤케 못함?","ㅇㅇ ","210.178 ","05.27"
"35세 수원과학대 만학도셧나 ㅡㅡ","하라구구 "," ","05.27"
"구토까는글 해념 ㄱㄱ","ㅇㅇ ","39.7 ","05.27"
"본인이 생각하는 축구선수 이름력 3top.","ㅇㅇ1 ","223.38 ","05.27"
"근데 팩트는 자국여자 비하하는 애들 싹다 ㅎㅌㅊ인건 씹팩트","ㅇㅇ ","117.111 ","05.27"
"저랑 비슷한 연배신데 하라구구님 자괴감 안느껴지심?","카라빱 ","117.111 ","05.27"
"아다갤러리인가 ㅡㅡ","하라구구 "," ","05.27"
"진짜 서양 ㅎㅌㅊ들은 이렇게 생겼다","ㅇㅇ ","211.46 ","05.27"
"리버풀 쳄스 4강 재경기해야한다 vs 하면안된다","긱스 "," ","05.27"
"■ 손뽕님들이 구단주면 손흥민vs음바페 누구삼? ■","백종원 ","39.7 ","05.27"
"손흥민 우승못하면 이제 우승기회없지않음??","개병신임 "," ","05.27"
"세미나인 7년뒤가 나임 ㅋㅋㅋ","하라구구 "," ","05.27"
"지금 갤 친목지수 너무 높은데 ㅡㅡ","하라구구 "," ","05.27"
"근데 진짜 리버풀 챔스결승 너무 씹에바인데 하 진짜","긱스 "," ","05.27"
"근데 fm 윙포워드가 수비 스텟 오르는 새끼들은 뭐임","ㅇㅇ ","125.180 ","05.27"
"삽님 이름이 호삽이라면서요","하라구구 "," ","05.27"
"그래 사장해라","하라구구 "," ","05.27"
"손흥민한테 지금 챔결전이 존나 중요한순간이냐?","ㅇㅇ ","211.36 ","05.27"
"도토리묵 빼고 아무도 모르겟는데","하라구구 "," ","05.27"
"하라구구님 저 무려 '사장'임","카라빱 ","14.37 ","05.27"
"저 부랄에 털 없어서 귀여움 ㅡㅡ","하라구구 "," ","05.27"
"먼 유학소녀가 서양에서 ㅍㅎㅌㅊ야 , 외국안살아봄?","ㅇㅇ1 ","223.38 ","05.27"
"구토들이 악질이많음","ㅇㅇ ","175.223 ","05.27"
"카라빱 백수새끼가 직업이 잇다네","하라구구 "," ","05.27"
"하라구구님 미안한데 저는 직업 인증도함","카라빱 ","14.37 ","05.27"
"4글자닉넴들이 귀염둥이들이 많음","하라구구 "," ","05.27"
"누구 양봉하냐? ","아라가키유이 "," ","05.27"
"3글자 닉넴들이 악질이 많음 ㅇㅇ","하라구구 "," ","05.27"
"젖닌들 추천박아라 ㄱㄱㄱ","ㅇㅇ ","39.7 ","05.27"
"양봉업이랑 문재인이랑 뭔 상관관계임","하라구구 "," ","05.27"
"음바페 중앙 톱으로도 잘하냐?","ㅇㅇ ","58.140 ","05.27"
"콸형 이번시즌끝으로 은퇴하냐?","긱스 "," ","05.27"
"콸리알레라는 그냥 플루크 터진거아님?","퀸치카 "," ","05.27"
"무슨 개소리야 외국가면 씨발 뚱녀들 천지인데","ㅇㅇ ","211.46 ","05.27"
"솔직히 박지성은 게임사로 치면 액티비전이지","ㅇㅇ1 ","223.38 ","05.27"
"챔스 득점왕이 8강,16강따리한테 나온적있냐","긱스 "," ","05.27"
"아르헨 국민들이 메시를 싫어하는 이유","ㅇㅇ ","175.223 ","05.27"
"악설아","하라구구 "," ","05.27"
"노무현으로 살기 vs 문재인으로 살기","ㅇㅇ ","121.164 ","05.27"
"메퀴들당황))지들이물고빨던 후스코어드 평점도르에서빠짐","ㅇㅇ ","1.229 ","05.27"
"떡이 뭐임","하라구구 "," ","05.27"
"콸리아렐라 말년인데 갑자기 존나 잘해진이유좀","긱스 "," ","05.27"
"백수라인 모집함 ㅡㅡ","하라구구 "," ","05.27"
"세미나인 욕하지마라 ㅡㅡ","하라구구 "," ","05.27"
"맹구 뮌헨 친선경기 방송 어디서 햇엇냐","포르자호라이즌 "," ","05.27"
"구하라 위로를 내가 어케해줌 ㅡㅡ","하라구구 "," ","05.27"
"산을 깎아서 평지로 만든 사례가 존재 하냐?","긱스 "," ","05.27"
"아르헨이 메시 싫어하는 이유= 손흥민 싫은이유 ","ㅇㅇ ","39.7 ","05.27"
"모기는 설계가 왜 이렇게 됐을까...","ㅇㅇ ","121.164 ","05.27"
"악설아 말벌은 어떻게하니","하라구구 "," ","05.27"
"내방보는 줄 알앗누 ㅋㅋㅋ","하라구구 "," ","05.27"
"메좆뛴 아르헨국대 베네수엘라한테 3-1로 쳐발림ㅋㅋㅋ","ㄴㄴㄱ ","175.223 ","05.27"
"악설이(27세 양봉업자) 왜 요즘 도통 안보임","하라구구 "," ","05.27"
"세미나인 보면 미래가 보임 ㅋㅋ","하라구구 "," ","05.27"
"메갓욕하지마 씨발","ㅇㅇ ","175.223 ","05.27"
"메호대전은 신기하네 ㅋㅋ 완벽하게 끝날만하면 서로 병신짓을하네 ㅋㅋ","ㅇㅇ ","120.136 ","05.27"
"구토까는글 해념 ㄱㄱ","ㅇㅇ ","115.20 ","05.27"
"팩트)kpop SNS 영향력은 영 미팝스타애들도 못이김","ㅇㅇ ","223.39 ","05.27"
"아랫배가 정확히 어디냐??","ㅇㅇ ","39.113 ","05.27"
"마동석 결혼 한다 뭐다 그러던데","MeNaldo ","119.205 ","05.27"
"코파델레이 메좆 뭔일있던거냐?","dd ","110.15 ","05.27"
"그리즈만 바르샤이적 확정임?","ㅇㅇ ","27.115 ","05.27"
"메시도 발롱 물건너가서 우짜노 ㅋㅋ","ㅇㅇ ","121.178 ","05.27"
"ㅇ","ㅇㅇ ","39.7 ","05.27"
"에이셉라키 에미넴 넘었냐??????","ㅇㅇ ","175.223 ","05.27"
"epl 득점왕 박지성으로 살기 vs k리그 득점왕 손흥민으로 살기","ㅇㅇ ","121.164 ","05.27"
"나상호는 국대 왜자꾸 뽑히냐?","zzms "," ","05.27"
"이동국이 혹사지 먼 밥줘영이 혹사야 ㄱㅋㅋ","카라빱 ","14.37 ","05.27"
"호날두 빠는애들은 왜 골잡이라고함?","ㅇㅇ ","223.39 ","05.27"
"메시 더블도못했는데 발롱맞냐?","ㅇㅇ ","58.140 ","05.27"
"첼시 챔스우승할때 감독이 누구엿음??","ㅇㅇ ","223.39 ","05.27"
"이정협 또 나와? ㅋㅋㅋㅋㅋㅋㅋㅋㅋㅋㅋㅋㅋㅋ","귤선생 ","1.240 ","05.27"
"키큰 새끼들 대부분 키는 큰데 발기술이 장점이다","ㅇㅇ ","175.206 ","05.27"
"25살에 군대간다고  ㅠㅠㅠㅠㅠㅠ","킹날두 ","211.36 ","05.27"
"에미넴 stan은 띵곡 중에 갓띵곡","ㅇㅇ ","61.73 ","05.27"
"박지성 전라도통수임 국대 배려에 국대 100경기 은퇴","ㅇㅇ ","106.102 ","05.27"
"토트넘이기면 버기패고 리버풀이기면 우솝패고","ㅇㅇ ","223.39 ","05.27"
"유로파 결승팀 둘다 7번 다 못나오냐??","ㅇㅇ ","223.39 ","05.27"
"콸간지 자파티는 개좆두한테 감사해야지","ㅇㅇ ","223.33 ","05.27"
"에미넴 vs 방탄 인지도는 누가 위","ㅇㅇ ","61.73 ","05.27"
"아니 두반 사파타가 삼프도리아 임대라고?","ME9 "," ","05.27"
"대학친구거리감살짝느껴지는건ㅍㅌ지..","ㅇㅇ4 ","180.71 ","05.27"
"손흥민 어차피 군사훈련때문에 한국와야하고 챔결 이전엔 푹 쉬잖아","ME9 "," ","05.27"
"자파타도 삼프도리아 임대네","MunshanUnjeree "," ","05.27"
"젖닌버기는 리밥응원하고 구토는 토트넘 응원하네 ㅋㅋ","ㅁㄴㅇㄹ ","115.89 ","05.27"
"손뽕들 국대뽑기만하면 혹사 ㅇㅈㄹ","ㅁㄴㅇㄹ "," ","05.27"
"손흥민 인성은 어떨거같음? 인성논란잇엇냐?????","ㅇㅇ ","211.36 ","05.27"
"네미 애미 도륙난 새끼가 왤케 깝침 진심 죽이고 싶네","MeNaldo ","221.144 ","05.27"
"해버지 비버통 존나웃기네 ㅋㅋㅋㅋㅋ","ㅇㅇ ","182.222 ","05.27"
"솔직히 메시 은퇴하면 바르샤 떡상할듯","ㅇㅇ ","124.216 ","05.27"
"ㅋㅋ 리옹 맨유 리버풀 토트넘 순으로 챔스 대진 햇으면","ㅇㅇ ","223.39 ","05.27"
"한국에서 손흥민 재능이 역대급이니깐 ","ㅇㅇ ","121.164 ","05.27"
"25살에 군대갈려고하는데","킹날두 ","211.36 ","05.27"
"바르샤 이번 챔스 16강 상대 누구엿지??","ㅇㅇ ","223.39 ","05.27"
"이정협은 누구임?","ㅇㅇ ","101.235 ","05.27"
"메시가 이번에 발롱도르받으면","1234 ","223.39 ","05.27"
"메좆 코파때메 발롱못받음 ㅇㅇ","ㅇㅇ ","115.20 ","05.27"
"이번 평가전에 황희찬 뛸수있는거야?","ㅇㅇ ","223.39 ","05.27"
"버기단들은 리버풀 응원하겠네 ","ㅇㅇ ","115.20 ","05.27"
"61.98 말귀 못알아쳐먹냐?","MeNaldo ","221.144 ","05.27"
"근데 내가 해충린이여서그런데 무관따리가 뭐야? 손박대전하면","ㅇㅇ ","223.39 ","05.27"
"흥민인 톳넘에서 인기많은데 박지성은 맨유에서 인기어땟냐?","ㅇㅇ ","211.36 ","05.27"
"아니 맨시티가 매과이어를 진짜 사겠냐","ㅇㅇ ","124.53 ","05.27"
"폰을 중3 때라도 사줬어봐 내가 이꼬라지였나","MeNaldo ","221.144 ","05.27"
"해킹, 유포, 사이버 괴롭힘 을 당하고 있습니다","ㅇㅇ ","49.143 ","05.27"
"호날두,박지성 사석에서 마주치면 아는척할거같음?","ㅇㅇ ","1.211 ","05.27"
"박지성은 손흥민 나이에 탈출각 잡고 있었는데ㅋㅋ","ㅇㅇ ","116.45 ","05.27"
"메좆 좆망하니까 6발롱 이새끼 기어나온거 귀엽네","ㅇㅇ ","175.194 ","05.27"
"진짜 반다이크가 발롱받는다고 생각하는 젖닌있냐?","ㅇㅇ ","110.70 ","05.27"
"후전드랑 백승호 이미 망한거 아니냐?","ㅇㅇ ","121.164 ","05.27"
