"dc_title","dc_writer","writer_ip","dc_date"
"좆흥민 서른 처먹도록 우승컵 없는대 킹강인은","울보손흥민 ","223.38 ","05.27"
"지금 바르샤 메시 빼도 세계최강 스쿼드임","ㅇㅇ ","210.126 ","05.27"
"결국 메시 연봉1200억받고 4년간 8884시키고 올시즌은 리그하나 끝?","택시드라이버 "," ","05.27"
"근데 국대 손흥민 어느정도 리스펙 해줘야하지 않냐","ㅇㅇ ","116.45 ","05.27"
"반다이크가 발롱 배당률 2위인 이유.txt","ㅇㅇ ","110.70 ","05.27"
"솔직히 우레이가 아시아에서 두번째 맞지않냐?","ㅇㅇ ","121.164 ","05.27"
"근데 라리가를 양학이라고 하면 호날두는 뭐가되는거?","ㅇㅇㅇ ","125.130 ","05.27"
"지금호날두가 박지성사석에서보면 인사할거같음?","ㅇㅇ ","1.211 ","05.27"
"찐따출신으로서 축구할때 기분좋았던썰","ㅇㅇ ","180.226 ","05.27"
"대구 애들 조금 떳다고 왜 안 뽑냐고 지랄 하는건 뭔데 ㅋㅋㅋㅋ","ㅇㅇ ","39.7 ","05.27"
"그래도 지성이형이 국대 가오살려준건 맞지않냐 ㅇㅇ","우리효 "," ","05.27"
"버기형 솔직히 생긴게 억울하게생겨서","ㅇㅇ ","106.101 ","05.27"
"짱남이 경리 닮음","ㅇㅇ ","175.223 ","05.27"
"http://m.dcinside.com/board/football_new","ㅇㅇ ","219.255 ","05.27"
"자동차가 연료 소모하면 물리적으로 있던 석유가 에너지로 바뀌면서","긱스 "," ","05.27"
"울 짱남이 복갤하기엔 요즘갤에 찐따력 너무 심한데","카라빱 ","14.37 ","05.27"
"아는형한테 개인기량 손&gt;&gt;&gt;&gt;&gt;박이라는데 자꾸 인정을안하길래","ㅇㅇ ","211.36 ","05.27"
"네드 스타크가 일찍죽은이유는 몸값이 비싸서일듯","ㅇㅇ ","61.98 ","05.27"
"대학가서 여사친 후배들하고 낭만없는애들 불쌍 ㅇㅇ","카라빱 ","14.37 ","05.27"
"Udt할려면 군사학과 가야되냐","ㅇㅇ4 ","180.71 ","05.27"
"U20 아시아 예선에서도 한국 우승 못했지???","알약 ","14.4 ","05.27"
"오늘 11시에 챔피언십 플옵이네 ㅋㅋㅋ","ㅇㅇ ","14.38 ","05.27"
"해충들아 물리학적으로 유에서 무가 되는거 가능하자너 ㅇㅇ","긱스 "," ","05.27"
"마동석도 슬슬이냐 ㅋㅋ","ㅇㅇ ","58.126 ","05.27"
"대학친구는 솔직히 비지니스관계 하위호환이긴하다","ㅇㅇ ","223.39 ","05.27"
"난 솔직히 복학하고 혼자 카페있는데 애들이 먼저왔음","카라빱 ","14.37 ","05.27"
"친선전 경기결과 딱 뻔하지않냐?","ㅇㅇ ","61.73 ","05.27"
"이제 영화에 페미 무조건 넣겠네","ㅇㅇ ","182.212 ","05.27"
"보닌 최전성기 고1. ㅇㅇ","MeNaldo ","119.205 ","05.27"
"대학친구다부질없다 겉친구","ㅇㅇ ","180.71 ","05.27"
"한국영화 전성기는 두사부일체 시리즈임","ㅇㅇ ","61.73 ","05.27"
"군대가면 ㅈㄴ폼ㅈㄴ올라왓을때 턱ㅈ걸이10개는하지?","ㅇㅇ ","180.71 ","05.27"
"이제 맹구는 유로파도 못가겠네","ㅇㅇ ","1.229 ","05.27"
"기생충 황금종려상 받았자너","MeNaldo ","119.205 ","05.27"
"대학가면 인사가 일과여야 인싸가능한거임 ㅇㅇ","카라빱 ","14.37 ","05.27"
"요즘 영화든 예능이든 국뽕 자극 소재는 좀 별로더라","ㅇㅇ ","223.39 ","05.27"
"한국이 뻥글대진이였으면 다시 4강신화 가능?","ㅇㅇ ","61.73 ","05.27"
"한국 근데 진짜 인재없네 반이상이 아시아 변방리그","ㅇㅇ ","211.104 ","05.27"
"보니까 개리그충들이 벤투욕하고 손까짓하는거였군??ㅋㅋㅋ","ㅇㅇ ","110.70 ","05.27"
"케인>>>>>흥좆이지","ㅇㅇ ","1.244 ","05.27"
"손흥민한테 챔결이떨릴거같냐 월드컵때가떨릴거같냐?","ㅇㅇ ","1.211 ","05.27"
"아는 여자동생인데 친구랑 보고와서 같이봐준대","카라빱 ","14.37 ","05.27"
"스페인 국왕컵이 잉글랜드 리그컵 같은거임???","ㅇㅇ ","116.41 ","05.27"
"그냥 한국감독쓰면안되나 ㅋㅋ 김신욱 김보경을안뽑는건 ㄹㅇ씹에반데","ㅇㅇ ","120.136 ","05.27"
"그래도 국대에 손흥민에 토트넘 훗스퍼 적혀있는거 보니까","우리효 "," ","05.27"
"디즈니탑3","⊙⊙ "," ","05.27"
"근데 프로선수들도 챔스결승이면 ㅈㄴ떨리겠지?","ㅇㅇ ","1.211 ","05.27"
"아직도 조선영화보러가는 흑우들없제??","ㅇㅇ "," ","05.27"
"★메시 = 주급도둑 = 산체스 = 77ㅓ억좌","ㅇㅇ ","175.114 ","05.27"
"나상호 이승우뽑고 김보경을 안뽑는게말이되노 ㅋㅋㅋ 이새끼도슈틸리케과네","ㅇㅇ ","120.136 ","05.27"
"치어리더는 존나 무료봉사수준이지","ㅇㅇ ","223.39 ","05.27"
"아버질 판다이크 vs 레이프 헤 데용","긱스 "," ","05.27"
"룸메랑말안하고사는데 비정상ㅈ임?","ㅇㅇ ","180.71 ","05.27"
"알라딘꿀잼임","⊙⊙ "," ","05.27"
"★메좆이 주급 24억이라고? 시발 월클 5명 5억씩만 줘도 트레블이지","ㅇㅇ ","175.114 ","05.27"
"여사친이 알라딘 개재밌다는데?","카라빱 ","14.37 ","05.27"
"후전드 벤치딱하고나서 베로나 승승장구 ㅋㅋㅋㅋ","ㅇㅇ ","121.161 ","05.27"
"와근데 백승호 나상호 이승우도 국대뽑히네 ㅋ 슈틸리케랑 똑같노","ㅇㅇ ","120.136 ","05.27"
"좆같은세레머니 top 3","ㅇㅇ ","45.33 ","05.27"
"난 구토지만 메시 주급24억받는다는데","ㅇㅇ ","211.36 ","05.27"
"존나 신기한점","bv ","221.140 ","05.27"
"룸메 랑 말안하고사는데정상?","ㅇㅇ ","180.71 ","05.27"
"와꾸안보는 알바 뭐있냐","ㅇㅇ ","121.146 ","05.27"
"한국감독 벤투 vs 이란감독 빌모츠 이 둘중에 누가 커리어 더 좋냐","ㅁㄴㅇㄹ ","106.102 ","05.27"
"찐따들 학폭당한건 알겠는데 10년 지나서 나 맞았어요 이러는건","ㅇㅇ ","223.39 ","05.27"
"근데 후전드는 이제 끝인거냐?","ㅇㅇ ","125.185 ","05.27"
"이정협이 대갈사비보다 잘하냐","ㅇㅇ ","223.38 ","05.27"
"어차피 너네 연우같은애 못만나자너 ㅇㅇ","카라빱 ","14.37 ","05.27"
"그래도 음악이나 드라마 스포츠나 이런거좋아하는여자가좋던데","ㅇㅇ ","120.136 ","05.27"
"안필드의 기적 날짜 잊어버린사람 있냐","유동닉 ","106.102 ","05.27"
"벤투새낀 손흥민 혹사 존나시키네","ㅁㄴㅇㄹ ","106.102 ","05.27"
"손흥민 축구표 한장이 봉준호 영화표 200장 가격정돈 되지?","ㅇㅇ ","210.126 ","05.27"
"여기 이스탄불 사기극 실시간으로 봤던사람 있냐","긱스 "," ","05.27"
"와 이번주 챔결이냐? 드디어 때가된거냐 기대된다","ㅇㅇ ","223.39 ","05.27"
"인생독고다이냐?","ㅇㅇ ","180.71 ","05.27"
"봉준호 축구로치면 피르미누급은 되냐","ㅇㅇ ","210.126 ","05.27"
"너네 축구못하면서 왜케 아는척해?","카라빱 ","14.37 ","05.27"
"해충들아 마지막에 밀너가 바르샤 상대로 시간끌었는데","긱스 "," ","05.27"
"티아라가 진짜 소시급은아니여도 최소 원더걸스급이였지","ㅇㅇ ","223.39 ","05.27"
"후전드 2부따리 주전이라고 딴선수들 무시하는것도 이제 못하는 후맘충들 ㅋ","ㅇㅇ ","121.161 ","05.27"
"이번 챔스는 둘 다 언더독이다 보니까","ㅇㅇ ","124.53 ","05.27"
"봉준호야 당연히 손흥민보다 위라고 쳐도 류현진은 안됨","ㅇㅇ ","210.126 ","05.27"
"아니 진심 리버풀 바르사전 4째 골은 축구의 흑역사 아니냐 진심","긱스 "," ","05.27"
"티가 안나서 그렇지 버기도 개유리아니냐","ㅇㅇ ","110.70 ","05.27"
"티아라 롤리폴리하나면 지금 걸그룹다패는거씹가능함","ㅇㅇ ","106.101 ","05.27"
"대학친구 vs 급식친구","ㅇㅇ ","180.71 ","05.27"
"군대진짜어트게아되냐","ㅇㅇ ","180.71 ","05.27"
"바르샤는 메시 빠지면 그게 리빌딩임","ㅇㅇ ","210.126 ","05.27"
"여기 이승우글은 하나같이 부들거림이 느껴짐 ","ㅇㅇ ","175.223 ","05.27"
"여자랑 대화하는게 머가 어렵다고 이론까지;","카라빱 ","14.37 ","05.27"
"박지성 이승우 황희찬은 방송감있을거같음 손흥민 기성용 구자철은","ㅇㅇ ","120.136 ","05.27"
"100억받고 중국깡촌길거리에서 노숙한다 한다vsㄴㄴ","ㅇㅇ ","180.71 ","05.27"
"이정협 국대 발탁이네??","레벨 ","58.143 ","05.27"
"이승우 근데 얘는 좀만 축구잘했으면 예능감 좋아서","ㅇㅇ ","120.136 ","05.27"
"후맘충들이 제일 많이 쓰는 단어 당돌 ㅋㅋㅋㅋㅋ","ㅇㅇ ","121.161 ","05.27"
"성악설님","카라빱 ","14.37 ","05.27"
"대학친구는ㄹㅇ정이안가는데 정상ㅈ이냐","ㅇㅇ ","180.71 ","05.27"
"진지) 바르셀로나 메시 빼고 리빌딩 필요하다 vs 하면 안된다","긱스 "," ","05.27"
"근데 박효신 성형했냐?","ㅇㅇ ","124.50 ","05.27"
"아이돌을 빠느니 차라리","ㅇㅇ ","223.39 ","05.27"
"메시 VS 반다이크","NBA좆고수 "," ","05.27"
"엑소 근데 ㅋㅋ걔네 안무보면 좀 빨릴만함 게이아니여도","ㅇㅇ ","120.136 ","05.27"
"박효신 vs 서강준 둘중 한명으로 살수있다면","ㅇㅇ ","175.119 ","05.27"
"좆두 메시없으면 득점왕할줄알았더니 4위했네","ㅇㅇ ","124.50 ","05.27"
"이로써 라리가는 씹양학 우물안 개구리 리그 맞지?","NBA좆고수 "," ","05.27"
"개꿀 (비)(트)[코][인] 어서가입 48만  &#x1f4a4;","상<U+2764>따 ","139.162 ","05.27"
"성악설님 남자랑이라도 사귀면 안됨?","카라빱 ","14.37 ","05.27"
"둘중 어느 얼굴 가질래?","ㅇㅇ ","223.33 ","05.27"
"근데 남친없는애들은 꼬실확률 90프로 넘지않냐?","카라빱 ","14.37 ","05.27"
"혹시 더블이라던 그새끼 어디갔나요?","NBA좆고수 "," ","05.27"
"바르샤에서 감독은 허수아비임","ㅇㅇ ","210.126 ","05.27"
"사실상 좆구토도 발렌시아한테 졌으니 아스날이 더잘하는거 맞지?","NBA좆고수 "," ","05.27"
"하메스같은유형이 가오살게축구하는거아님?","ㅇㅇ4 ","180.71 ","05.27"
"나랑 친했던 누나는 나한테 맨날 끼부리지 말라고함","카라빱 ","14.37 ","05.27"
"승우맘이라는게 아직도 있었던거임? 와 ㅋㅋㅋ","ㅇㅇ ","120.136 ","05.27"
"나지금 축구테스트보러 마드리드왔다 응원좀","ㅇㅇ4 ","180.71 ","05.27"
"하긴 급식때는 이쁜선생있으면 존나깝쳐서 일부러 헤드락걸리곤했지","ㅇㅇ ","223.39 ","05.27"
"바르사는 왜 명감독 안쓰냐","ㅁㄴ ","175.223 ","05.27"
"짱깨수비수쓰면 러시아 모로코전 꼴나는데 ㅋㅋㅋㅋㅋ","ㅇㅇ ","211.195 ","05.27"
"여자 보지 무슨색이냐?","ㅇㅇ ","223.62 ","05.27"
"팁줌 진심 인사만 잘해줘도 너네 개씹호감됨 ㅇㅇ","카라빱 ","14.37 ","05.27"
"막말로 조선학교 이제갈필요없지 ㅋㅋ","엘제이떠블류 "," ","05.27"
"무명이 ㅇㅁ ","ㅇㅇ4 ","180.71 ","05.27"
"일욜날 스포티비 주최로","ㅇㅇ ","220.77 ","05.27"
"좆구토 코파우승도못했으니까 발롱 반다이크 확정 ㅋㅋㅋ","NBA좆고수 "," ","05.27"
"여자랑 얘기하는데 젖통에 얼굴 비비면 어케됨?","ㅇㅇ ","211.223 ","05.27"
"학교에서 안녕~이것도 못하는새끼들 투성이더라","카라빱 ","14.37 ","05.27"
"콜롬비아갔을때인종차별당햇는데 똑같이갈궈서 멘탈터트린적있다","ㅇㅇ4 ","180.71 ","05.27"
"메시 중심으로 짜여지는 팀 전술 자체가 문제임","ㅇㅇ ","210.126 ","05.27"
"어릴때는 해외축구 중계창이나 댓글창에 욕설 도배되는거 보고","ㅇㅇ ","27.1 ","05.27"
"근데 그거알음?중국이 ㅈㄴ 남미보다위험한나라임","ㅇㅇ4 ","180.71 ","05.27"
"여기서 여자얘기 하는애들 실제론 여자앞에서 말도 못하는","ㅇㅇ ","211.223 ","05.27"
"맨유에 박지성 말고 또 영구결번 있냐??","긱스 "," ","05.27"
"긱스님 빨통만지는건 성욕이랑 무슨 상관임","카라빱 ","14.37 ","05.27"
"야구보는새끼들은좀 이해안되더라 ㅋㅋ","엘제이떠블류 "," ","05.27"
"여자한테 접근하는거 벌벌떠는애들 난 이해안감","카라빱 ","14.37 ","05.27"
"본인은 금욕주의자라 여자들이 섹스해달라고 줄서도","긱스 "," ","05.27"
"아는분부인 중국에서납치당함","ㅇㅇ4 ","180.71 ","05.27"
"호날두 3행시","긱스 "," ","05.27"
"머학시절에 책안가져오고 맘에드는애 옆에 앉았는데","카라빱 ","14.37 ","05.27"
"중국 아직도 장기매매 있음?","ㅇㅇ ","211.223 ","05.27"
"ㅋㅋ학창시절에 이게 추억인데","bv ","221.140 ","05.27"
"중국가서 납치당하기싫으면어케해야됨?","ㅇㅇ4 ","180.71 ","05.27"
"중학교졸업하기전에 첫섹스함","카라빱 ","14.37 ","05.27"
"근데  류현진 리그가 왜 가짜 리그임?","ㅇㅇ ","223.62 ","05.27"
"마르키시오 - 박지성은 외모때문에 저평가받는선수이다","긱스 "," ","05.27"
"메좆새끼가 ㄹㅇ 초럭키 이승우지","ㅇㅇ ","219.254 ","05.27"
"박지성은 못생겨서 죽어라 까이는거임","ㅇㅇ ","211.223 ","05.27"
"ㅋㅋㅋㅋ 진짜 학교다닐때 친한여자애가 교과서나 체육복빌려주면","ㅇㅇ ","223.39 ","05.27"
"모라타 첼시로  언제 돌아오나요?","ㅇㅇ ","223.38 ","05.27"
"친박티콘님 개찐따면서 왜 인싸떡밥끼려함?","카라빱 ","14.37 ","05.27"
"지네딘 지단 - 박지성은 국적때문에 저평가받는 선수이다","긱스 "," ","05.27"
"급식때 섹스해본 새끼들 있냐","ㅇㅇ ","223.62 ","05.27"
"근데 학식도 여자들밥조금주긴하더라 이거존나느낀게","ㅇㅇ ","120.136 ","05.27"
"근데 네좆은 빠는데 호날두는 까는거 뭐냐","ㅇㅇ ","1.244 ","05.27"
"급식축구 수준은 굳이 주발안써도 될듯","카라빱 ","14.37 ","05.27"
"해축문학) 리오넬 메시 5행시","ㅇㅇ ","183.106 ","05.27"
"중국이 여행으로라도위험핝나라냐?","ㅇㅇ4 ","180.71 ","05.27"
"근데 런던에서 아제르바이잔까지 그렇게 머냐???????","ㅇㅇ ","58.227 ","05.27"
"네이마르 경기 볼터치영상 수십개는봤는데","bv ","221.140 ","05.27"
"카라빱 실축 한번 뛸래??","레벨 ","58.143 ","05.27"
"걍 짜져 있자너","ㅇㅇ ","1.244 ","05.27"
"바르샤 매번 실패하는거 메시잘못 아니라는거 웃기지 않냐 ㅋㅋ","ㅇㅇ ","210.126 ","05.27"
"ㅁ","캉테는내친구 "," ","05.27"
"근데 세르지오로 마네못막으면서 왜2차전때 또쓴거임?","ㅇㅇ ","175.123 ","05.27"
"나 투박한 스탈인데 급식축구때는 걍 메시놀이함","카라빱 ","14.37 ","05.27"
"급식축구가 축구냐 ㅋㅋㅋㅋ","카라빱 ","14.37 ","05.27"
"급식때 체육대회 반대항전 골 안넣어본새끼는 닥쳐라","ㅇㅇ ","223.62 ","05.27"
"오시발 드디어 정우영 지동원 구자지를.안보는구나","축잘알 ","222.239 ","05.27"
"진화론이 사실이면 빡빡이들은 왜있냐","긱스 "," ","05.27"
"축구 잘할려면 공부하지말고 리프팅만 죽어라고해라","ㅇㅇ ","211.223 ","05.27"
"우리도 급식아줌마가 남자들 밥더많이줘서 ㅋㅋ 여자애들급식아줌마랑","ㅇㅇ ","120.136 ","05.27"
"진짜 개좆찐따그지새끼득 교복입으면","ㅇㅇ ","223.39 ","05.27"
"더리흐트가 쿨리발리보다 잘하냐?","ㅇㅇ ","58.229 ","05.27"
"드리블 잘하는애들은 특징이있음","bv ","221.140 ","05.27"
"난 급식때 축구 1도 안해봤는데","ㅇㅇ ","223.62 ","05.27"
"비트코인 1500은 뚫을거임","종이비행기 "," ","05.27"
"친박티콘님 축구 좆도 못하자나여 ㅇㅇ","카라빱 ","14.37 ","05.27"
"지금 선발명단때문에 포체티노 머리터질 지경임.txt","ㅇㅇ ","61.41 ","05.27"
"들박하는건 힘도되야가능?","ㅇㅇ4 ","180.71 ","05.27"
"손흥민결장하고 리버풀우승이면 손뽕들이 더 난리나지 ㅋㅋ 빡대갈인가","ㅇㅇ ","120.136 ","05.27"
"축구 잘하는놈중엔 찐따가 없다","ㅇㅇ ","211.223 ","05.27"
"한국하면 외국에서는 북한밖에모름ㅋㅋㅋㅋ","ㅁㅁ ","211.208 ","05.27"
"[오피셜] 6월 호주, 이란 2연전 A매치 명단 발표","ㅇㅇ ","222.120 ","05.27"
"지단이 우위냐 사비가 우위냐 ","긱스 "," ","05.27"
"니들 안잡혀간다고 치면 몇살짜리 여자까지 섹스할거냐?","ㅇㅇ ","117.111 ","05.27"
"아니근데 학창시절에 찐따가 축구좋아하는걸 본적이없음","bv ","221.140 ","05.27"
"찐 ㅇㅇ","카라빱 ","14.37 ","05.27"
"진짜 찐특)","ㅇㅇ ","223.62 ","05.27"
"■ 손뽕들 단체자살 시나리오.scenario ■","백종원 ","211.193 ","05.27"
"일본av에 흑인은 나오지 말아야함","고양이야설작가 "," ","05.27"
"이번 여름이적시장때 유럽 갈만한 김치선수 있냐","ㅇㅇ ","39.7 ","05.27"
"찐특","bv ","221.140 ","05.27"
"메시는 쿠티뉴 뎀벨레 수아레즈 팔면 대안이라도 있음?","ㅇㅇ ","211.223 ","05.27"
"일본av에나오는 흑형은 직업임?개꿀직업?","ㅇㅇ4 ","180.71 ","05.27"
"나 지금 짝녀 생각하면서 허리 흔드는중","ㅇㅇ ","223.62 ","05.27"
"걍 아는애들 끼리 떠들고 평범하게 사는 찐인데","ㅇㅇ ","1.244 ","05.27"
"뎀벨레,쿠티뉴 요즘 폼 어떠냐?","ㅇㅇ ","211.36 ","05.27"
"근데 찐따가 왜 죄냐?","ㅇㅇ ","1.244 ","05.27"
"챔스 4강&gt;8강. 국왕컵 결승&gt;&gt;&gt;8강. 득점왕&gt;&gt;&gt;&gt;득점4위","ㅇㅇ ","175.223 ","05.27"
"야 씨벌새끼야 찐따는 축구보면 안되냐?개호로새끼네 저거","ㅇㅇ ","223.62 ","05.27"
"근데진짜구라안까고 류현진경기도 주말8시30분이나 새벽에했으면","ㅇㅇ ","120.136 ","05.27"
"근데 해축갤엔 찐따가 왜케많냐?","bv ","221.140 ","05.27"
"최순실하고 이강인하고 비슷한 위치 아니냐?","dd ","211.57 ","05.27"
"토토방에 챔스하고 유로파 경기 지금 토토 할 수 있음?","ㅇㅇ ","223.39 ","05.27"
"버기도 믿을 구석이 있으니 깝치는거지 ㅋㅋ","ㅁㄴㅇㄹ "," ","05.27"
"와 정우영 이제 1군 올라가냐??? 승격시켰네 ","ㅇㅇ ","211.195 ","05.27"
"아니그리고 류현진은 여성팬들한테 노관심이자나솔직히 슈퍼스타면","ㅇㅇ ","120.136 ","05.27"
"정우영 분데스 3부 승격 성공했네?","ㅇㅇ ","223.39 ","05.27"
"갓본 멕시코 3:0으로 후드러팻네 ㅋㅋㅋㅋㅋㅋㅋ","엘제이떠블류 "," ","05.27"
"ㅋㅋㅋㅋㅋ 축구 개거지스포츠랑 야구를 인기비교하려하네","ㅇㅇ ","223.39 ","05.27"
"국내 스포츠 인기도) 국내야구, 국대축구 투탑","ㅇㅇ ","61.41 ","05.27"
"언제적 뻥글랜드 ㅇㅈㄹ이냐 ㅋㅋ","리빅아 ","211.246 ","05.27"
"국가대표경기에서 오 승리를 위하여 언제 틀어주냐???","ㅇㅇ ","211.195 ","05.27"
"중국 이랑 나토가 붙으면 누가 이김?","ㅇㅇ ","211.223 ","05.27"
"메시 발롱 못받겟는데","ㅇㅇ ","211.184 ","05.27"
"아직 EU &gt; 중국인데 중뽕 날조보소 ㅋㅋㅋ김민재? ㅋㅋㅋ","ㅁㄴㅇㄹ ","220.126 ","05.27"
"졷두 이번시즌 세리에기록","ㅇㅇ ","121.128 ","05.27"
"콸호대전 빤스런 존나추하네","ㅇㅇ ","110.13 ","05.27"
"지금 워낙 챔결 관심도가 높아서 50만명 이상은 볼듯","ㅇㅇ ","211.223 ","05.27"
"나 대학에 좋아하는 여자애랑 눈도 못마주치고 어버버댔었는데","ㅇㅇ ","117.111 ","05.27"
"그리즈만도 지공상황 노답아니냐?","bv ","221.140 ","05.27"
"그냥 류현진 지금 '정현'하고 있는거임 두경기난타당하면","ㅇㅇ ","120.136 ","05.27"
"그래서 류현진 명전갈수있냐?","ㅇㅇ ","211.36 ","05.27"
"솔직히 손흥민 챔스결승때 선발에서 빠졌으면 좋겠음","ㅇㅇ ","220.85 ","05.27"
"호날두는 원래 리그는 못함","ㅇㅇ ","223.38 ","05.27"
"한국에서 해축인기가어딨냐 그냥 손흥민팬이대다수지","ㅇㅇ ","120.136 ","05.27"
"유벤투스는 호날두가 갔으면 호날두 위한 전술 짜야지","ㅇㅇ ","174.6 ","05.27"
"형들대학수업4번까지째는건ㄱㅊ지?","ㅇㅇ4 ","180.71 ","05.27"
"념글 날조 좆되네 진짜 ㅋㅋ","bv ","221.140 ","05.27"
"미국은 도르트문트 선수도 있잖아","ㅇㅇ ","211.195 ","05.27"
"애초에 한국에서 해축인기가 생각보다 높은게 아님","ㅇㅇ ","58.227 ","05.27"
"메좆이 방출 요청했다는건 매일 나오네 ㅋㅋㅋ","균따 "," ","05.27"
"겸손한 사람에게 까가 얼마나 붙겠냐","ㅇㅇ ","211.223 ","05.27"
"다르빗슈는 혼혈이라 좀 튼튼할줄 알았는데","ㅁㄴㅇㄹ ","220.126 ","05.27"
"베컴 06-07에 레알 멱살잡고 씹캐리하고 떠났는데","젝스키스 ","210.206 ","05.27"
"손뽕들은 토막내서 개구리밥으로 던져줘야함","손뽕토막 ","211.50 ","05.27"
"미국이 존나 어마어마한 나라인 건 맞음 미뽕 맞아도 이해 감","ㅇㅇ ","175.204 ","05.27"
"현재 유럽4대강팀","리빅아 ","211.246 ","05.27"
"어휴 그놈의 학폭학폭 시발ㅋㅋㅋㅋ","ㅇㅇ ","175.119 ","05.27"
"아니 날두네 또졌어???","ㅇㅇ ","182.224 ","05.27"
"와 챔스 이제 며칠 안남았네","앙강퀴 "," ","05.27"
"다저스가 축구로 치면 레알마드리드잖아","ㅇㅇ ","223.39 ","05.27"
"그렇게 따지면 우리나라 조폭도 외국에서 보면 우스운 정도임.","ㅇㅇ ","61.41 ","05.27"
"나도 손뽕이지만 진짜 심하긴하네 씨발 ㅋㅋ","ㅇㅇ ","223.39 ","05.27"
"박지성 스스로 까를 만든거지","ㅇㅇ ","211.223 ","05.27"
"그래도 성별통합 전연령 인지도는 손&gt;류아니냐?","ㅇㅇ ","120.136 ","05.27"
"손흥민은 칼럼 윌슨이랑 동급이지","ㅇㅇ ","124.53 ","05.27"
"Fabio Quagliarella. 이름력 좆간지인데 뭔솔","ㅇㅇ ","175.204 ","05.27"
"콸호대전 누가이겻어","ㅇㅇ ","182.224 ","05.27"
"영국에서도 클롭 스위스행에 관심 보이던데","ㅇㅇ ","124.53 ","05.27"
"손뽕은 현실감각이 없다","ㅇㅇ ","1.244 ","05.27"
"리버풀=아이언맨 인 이유","ㅎㅎ ","115.86 ","05.27"
"그래도 네이버시청자동접수는 손흥민&gt;류현진이던데","ㅇㅇ ","120.136 ","05.27"
"박지성이 쿨하게 인정했으면 덜 까였을지도","ㅇㅇ ","211.223 ","05.27"
"류현진 손흥민 단순시청률비교는에바지 시간대도 빠따가훨씬좋고","ㅇㅇ ","120.136 ","05.27"
"캐스터 말고 ‘해설’ 마지노선 정해준다","ㅇㅇ ","175.204 ","05.27"
"참고로 우리학교 일진들은 호날두 인기많았다","킹날두 ","211.36 ","05.27"
"축구 클럽들 혹시 클럽 전용 마사지사도 고용해서 쓰냐","유동닉 ","211.255 ","05.27"
"6월 A매치 국가대표 선발 명단 언제 나오냐? 오늘인데","ㅇㅇ ","211.195 ","05.27"
"전반 15분에 4~5번 역습나와야 된다는게 맞는 해설이냐?","ㅇㅇ ","122.46 ","05.27"
"축구선수인데 체지방많은 돼지있냐?","유동닉 ","211.255 ","05.27"
"근데 메좆은 10킬로 뛰면 죽는병 걸림? 왜케 활동량이..흠","유동닉 ","211.255 ","05.27"
"속보) 1.244 고닉 반다이크 떴다 ㅋㅋ","bv ","221.140 ","05.27"
"빠따 흥하는이유 = 보댕이들이 많이봐서 이거 팩트 ㅇㅇ","ㅇㅇ ","106.102 ","05.27"
"해충에서 손박대전 하듯이 야구커뮤에선 류박대전하냐?","ㅇㅇ ","49.142 ","05.27"
"병신들아 이영표가 손흥민>>>살라라고 했고","ㅇㅇ ","1.244 ","05.27"
"빠따가 시청률높을수밖에없지 아재들이 티비로보자너","ㅇㅇ ","120.136 ","05.27"
"류현진이 그리잘하냐?","bv ","221.140 ","05.27"
"다르빗슈가 이피엘선수로 치면 누구급이냐?","ㅇㅇ ","49.142 ","05.27"
"솔직히 아시아선수가 올해 메시랑 똑같은 활약하면","ㅁㄴㅇㄹ ","220.126 ","05.27"
"유벤투스 ㄹㅇ 호날두 없으면 리그우승도 힘들겠는데","ㅇㅇ ","211.36 ","05.27"
"아니 호날두는 우리반 상대로 1골도 못넣는다니까","ㅇㅇ ","223.62 ","05.27"
"이영표는 해설 좀 안 했으면","ㅇㅇ ","175.204 ","05.27"
"안필드의 참사 원흉이 메좆이라는게 사실이냐","유동닉 ","211.255 ","05.27"
"류현진은 3040한테 인기 많고","ㅇㅇ ","211.36 ","05.27"
"팩트는 호날두는 k리그와도 똑같음ㅋㅋ","bv ","221.140 ","05.27"
"근데 버기 출전한 바르샤:맨유 결승은 개노잼매치 중 하나였음","ㅇㅈㅇ ","223.33 ","05.27"
"손뽕새끼들 가불기 미리가져왔다","정신나감 ","211.36 ","05.27"
"가천대정도면 공부 열심히한거아니냐","ㅇㅇ ","39.7 ","05.27"
"근데 호날두 한 명 vs. 그냥 일반 축구하는 고딩 11명","ㅇㅇ ","175.204 ","05.27"
"상명대 vs 명지대","ㅇㅇ ","39.7 ","05.27"
"오늘도 대학 여자 동기 인스타사진으로 딸쳤는데 정상??","ㅇㅇ ","117.111 ","05.27"
"요즘 인문계 이과 반에서 10등하면 ㅇㄷ감?","ㅇㅇ ","39.7 ","05.27"
"상명대는 진짜 ㄹㅇ처음 들어봤네","ㅇㅇ ","1.244 ","05.27"
"상명대 vs 가천대 ㅇㄷ?","ㅇㅇ ","39.7 ","05.27"
"그님대 씨발아 상명대면 인서울 중위권이고만","ㅇㅇ ","39.7 ","05.27"
"카라빱 나한테 맞아서 죽었는데","긱스 "," ","05.27"
"기성용이 국대서 헤딩 많이 했었냐?","ㅇㅇ ","61.41 ","05.27"
"킹스트 이제 리중딱 못 하더라 오지게 까여서","ㅇㅇ ","174.6 ","05.27"
"냉정하게 상명대 학벌이면 ㅅㅌㅊ지?","ㅇㅇ ","39.7 ","05.27"
"호날두 진지하게 우리반도 못이길듯ㅇㅇ","ㅇㅇ ","223.62 ","05.27"
"버기 요즘 그래도 실상들어나고 까이는거보니","ㅇㅇ ","111.171 ","05.27"
"빨사형 잘패던 카라빱님 다비드데헤아님 어디가셨지..","빨통사냥꾼사냥꾼 ","39.7 ","05.27"
